movie_name,Release Year,Reviewer name,Clean_Review_date,Clean_Review,Clean_Comment Count,Like count,genre,Processed Review,Sentiment
Clue,1985,Branson Reese,1996-10-16,My dad got in so much trouble for showing me this as a kid because I started saying 'I'm gonna go home and ??at school.,6,2286,Comedy,dad got much trouble showing kid started saying ' i'm gonna go home ? ? school .,0
Beetlejuice,1988,Branson Reese,1999-10-21,Thank GOD Tim Burton made this movie in 1988 and not 2008. Can you imagine what a piece of shit this would've been with a ton of green & purple CGI swirls and Johnny Depp as Beetlejuice? Goddamn.,12,3304,Comedy,thank god tim burton made movie 1988 2008 . imagine piece shit would've ton green & purple cgi swirl johnny depp beetlejuice ? goddamn .,0
Being John Malkovich,1999,Than Tibbetts,2010-10-04,"Malkovich. Malkovich Malkovich Malkovich, Malkovich. Malkovich? Malkovich, Malkovich Malkovich. Malkovich! Malkovich? Malkovich Malkovich Malkovich. Malkovich, Malkovich, Malkovich, Malkovich... Malkovich. Malkovich Malkovich, Malkovich. Malkovich? Malkovich, Malkovich Malkovich. Malkovich!",6,4300,Comedy,"malkovich . malkovich malkovich malkovich , malkovich . malkovich ? malkovich , malkovich malkovich . malkovich ! malkovich ? malkovich malkovich malkovich . malkovich , malkovich , malkovich , malkovich ... malkovich . malkovich malkovich , malkovich . malkovich ? malkovich , malkovich malkovich . malkovich !",0
The Muppets,2011,Jeff,2012-03-06,"It's fine if you don't like this movie, but it probably means you're an angry, hate-filled asshole, and fuck you.",31,0,Comedy,"fine like movie , probably mean angry , hate-filled asshole , fuck .",-1
Mysterious Skin,2004,Cole,2012-03-11,"This movie is beautiful, captivating, fascinating, moving, powerful and an absolute masterpiece.",4,623,Drama,"movie beautiful , captivating , fascinating , moving , powerful absolute masterpiece .",1
(500) Days of Summer,2009,GirlsBlood,2012-05-06,"I thought I was the only one who listened to The Smiths"" - The main guy""""""",18,3335,Romance,"thought one listened smith "" - main guy "" "" """,0
Casablanca,1942,DirkH,2012-08-28,"I hate it when people say stuff like: You should watch this because it's a masterpiece!""""""""",6,4392,Drama,"hate people say stuff like : watch masterpiece ! "" "" """,1
Before Sunrise,1995,DirkH,2012-09-03,The best love poem ever filmed.,15,668,Romance,best love poem ever filmed .,1
The Thing,1982,DirkH,2012-10-06,100% pure horror.,48,4466,Horror,100 % pure horror .,-1
Labyrinth,1986,FilmApe,2012-10-08,David Bowie's Bulge The Movie.,6,0,Fantasy,david bowie's bulge movie .,0
Clueless,1995,Cole,2013-01-08,No one has ever looked as good on screen as Alicia Silverstone in Clueless.,15,0,Comedy,one ever looked good screen alicia silverstone clueless .,0
Stoker,2013,Joe,2013-04-01,"Does for belts, sand castles, staircases, pianos, pencils, pencil sharpeners, ice cream, freezers, phone booths, shoes, duck hunts, dinner, garden shears, shovels, metronomes, and showers what Psycho did for showers.",6,2108,Drama,"belt , sand castle , staircase , piano , pencil , pencil sharpener , ice cream , freezer , phone booth , shoe , duck hunt , dinner , garden shear , shovel , metronome , shower psycho shower .",0
The Shawshank Redemption,1994,Peaceful Stoner,2013-04-25,"If you ever feel down,If you ever feel like giving up,If you ever feel like nothing is gonna workout,If you ever feel hopeless,If you ever feel like dying,",34,282,Drama,"ever feel , ever feel like giving , ever feel like nothing gonna workout , ever feel hopeless , ever feel like dying ,",0
Se7en,1995,Jim,2013-04-26,90% of horror films nowadays get no where near as creepy or lurid as even the  of,6,2641,Mystery,90 % horror film nowadays get near creepy lurid even,0
The Great Gatsby,2013,Ozols,2013-05-10,"Uses of the word fuck"" in Casino: 398.Uses of the words """"old sport"""" in Gatsby: 426.""""""",20,0,Drama,"us word fuck "" casino : 398.uses word "" "" old sport "" "" gatsby : 426 . "" "" """,0
Before Sunset,2004,Sam Van Hallgren,2013-06-08,The first shot of Celine in the bookshop. The car ride when they nearly touch each other. The look on Celine's face as they walk up the stairs. Nina Simone.,2,4666,Romance,first shot celine bookshop . car ride nearly touch . look celine's face walk stair . nina simone .,0
A Trip to the Moon,1902,Joe,2013-10-20,I still don't understand why they went to the moon.,45,0,Adventure,still understand went moon .,0
The Blair Witch Project,1999,russman,2013-10-29,"With how annoying these characters were, I was rooting for the witch",6,0,Horror,"annoying character , rooting witch",-1
Enter the Void,2009,Eli Hayes,2013-11-21,A very light romantic comedy.Good for a first date.,65,161,Drama,light romantic comedy.good first date .,0
Citizen Kane,1941,PTAbro,2013-12-04,[Redundant praise][Joke about sleds][Regurgitated and bastardized interpretations of technical feats of skill on display][Insincere complaint about waiting so long to watch][Unnecessary recommendation for anyone who hasn't seen it to finally do so],16,2092,Drama,[ redundant praise ] [ joke sled ] [ regurgitated bastardized interpretation technical feat skill display ] [ insincere complaint waiting long watch ] [ unnecessary recommendation anyone seen finally ],0
Amadeus,1984,Amadeus,2013-12-06,Perfection.,31,2995,Drama,perfection .,1
After Hours,1985,davidehrlich,2013-12-09,Noah Baumbach was terrific as the lead.,6,2645,Comedy,noah baumbach terrific lead .,1
Die Hard,1988,DirkH,2013-12-23,Crackling fire in the fireplace.,22,2186,Action,crackling fire fireplace .,-1
Batman Returns,1992,matt lynch,2013-12-30,"Three cosplaying homicidal psychotics driven insane by a pulpy cocktail of sexual desire, emotional trauma, and socioeconomic anxiety wage open, armed conflict in a major metropolitan area. This was bankrolled by a major studio and released to an eager public.",3,0,Action,"three cosplaying homicidal psychotic driven insane pulpy cocktail sexual desire , emotional trauma , socioeconomic anxiety wage open , armed conflict major metropolitan area . bankrolled major studio released eager public .",0
But I’m a Cheerleader,1999,evan,2014-01-04,Michelle Williams shows up for a few minutes.,1,4152,Comedy,michelle williams show minute .,0
Rushmore,1998,Josh Larsen,2014-01-24,Dirk Calloway is really the only one here with a decent head on his shoulders.,12,2535,Comedy,dirk calloway really one decent head shoulder .,0
The Virgin Suicides,1999,robyn,2014-02-10,"Do you have a film that makes you so happy but so completely sad at the same time? Because this film, this hazy and soft and sparkly film is mine.",5,0,Drama,"film make happy completely sad time ? film , hazy soft sparkly film mine .",0
Fantastic Mr. Fox,2009,matt lynch,2014-02-10,(12 and 3/8 fox stars),1,2355,Animation,( 12 3/8 fox star ),0
Her,2013,Tiago Costa,2014-02-16,"The biggest achievement of Her is that it makes you feel sorry for a guy who has dated Rooney Mara, Olivia Wilde, Amy Adams, and Scarlett Johansson's voice.",6,0,Romance,"biggest achievement make feel sorry guy dated rooney mara , olivia wilde , amy adam , scarlett johansson's voice .",0
The Royal Tenenbaums,2001,Evan,2014-03-21,The scene with Richie Tenenbaum is in the bathroom while Needle in the Hay plays....powerful stuff. It gives me chills every time,11,4205,Comedy,scene richie tenenbaum bathroom needle hay play ... powerful stuff . give chill every time,0
Ferris Bueller's Day Off,1986,ScreeningNotes,2014-04-01,"In a selfish attempt to cope with his separation anxiety, a sociopathic student abuses his relationship with his mentally unstable best friend in order to throw his future away on a single day of raucous debauchery.",153,0,Comedy,"selfish attempt cope separation anxiety , sociopathic student abuse relationship mentally unstable best friend order throw future away single day raucous debauchery .",0
The Great Gatsby,2013,russman,2014-04-01,Glad they included all of my favorite musical artists of the 1920s. That Jay-Z sure was the bee's knees.,6,3936,Drama,glad included favorite musical artist 1920s . jay-z sure bee's knee .,1
American Psycho,2000,SilentDawn,2014-08-09,Christian Bale deserved an Oscar.,6,6320,Thriller,christian bale deserved oscar .,0
Birdman or (The Unexpected Virtue of Ignorance),2014,Evan,2014-10-20,Brilliant. Absolutely Fucking Brilliant.,32,0,Drama,brilliant . absolutely fucking brilliant .,1
Don't Worry Darling,2022,Vahniteja,2014-10-21,A movie as good as its sweaters (the sweaters are excellent),105,14163,Thriller,movie good sweater ( sweater excellent ),1
My Neighbor Totoro,1988,David Jenkins,2014-10-21,"rooney mara absentmindedly adding good luck with your... video game"" after verbally ripping his ass to shreds in front of an entire restaurant is EASILY one of the best lines of dialogue in the last decade of cinema""""""",33,13051,Animation,"rooney mara absentmindedly adding good luck ... video game "" verbally ripping as shred front entire restaurant easily one best line dialogue last decade cinema "" "" """,0
Interstellar,2014,Evan,2014-11-10,Oh. My. God.,6,6686,Sci-Fi,oh . . god .,1
The Dark Knight,2008,CinemaCl????wn,2014-11-11,"If you do not like this movie, I do not like you.",226,608,Action,"like movie , like .",1
Whiplash,2014,Laura Raud,2014-11-22,My mind exploded watching this movie.,18,890,Drama,mind exploded watching movie .,0
Inherent Vice,2014,Matt Singer,2014-12-01,Every ticket to INHERENT VICE should come with the choice of a joint or a second ticket to INHERENT VICE. You will need one or the other.,14,3412,Comedy,every ticket inherent vice come choice joint second ticket inherent vice . need one .,0
A Serbian Film,2010,Silent J,2014-12-05,I watched this on the recommendation of a friend who said this was one of his favorite films.,21,4465,Horror,watched recommendation friend said one favorite film .,1
Cars,2006,Tommy Brennan,2015-01-04,HOW THE FUCK DO THESE CARS REPRODUCE,58,0,Animation,fuck car reproduce,-1
Whiplash,2014,Lucy,2015-01-26,my heart was in my throat the entire movie... until the final act when it fell out of my ass,4,3502,Drama,heart throat entire movie ... final act fell as,0
The Grand Budapest Hotel,2014,josh lewis,2015-02-19,is it possible to frame an entire feature film and hang it on your wall? have we discovered how to do this? asking for a friend.,5,6625,Comedy,possible frame entire feature film hang wall ? discovered ? asking friend .,0
Ex Machina,2014,davidehrlich,2015-03-03,added to my evolving thinkpiece on AI stories that are really about how threatened men feel by the women around them.,26,2254,Sci-Fi,added evolving thinkpiece ai story really threatened men feel woman around .,0
Groundhog Day,1993,Matt Singer,2015-03-06,The story of a man who thinks he's a god who actually becomes a god and finally learns how to be a man.,6,4042,Fantasy,story man think he's god actually becomes god finally learns man .,0
Zoolander,2001,josh lewis,2015-03-10,"you know, the term masterpiece"" gets tossed around a lot these days but...""""""",2,4383,Comedy,"know , term masterpiece "" get tossed around lot day ... "" "" """,0
Dazed and Confused,1993,Ed Glendenning,2015-03-25,Is it normal to feel nostalgic about a time & place I didn't even exist in?,16,253,Comedy,normal feel nostalgic time & place even exist ?,0
Ex Machina,2014,Matt Singer,2015-04-23,Viewing #2 was interesting. I feel like you watch the first time as Caleb and the second as Nathan.,41,4461,Sci-Fi,viewing # 2 interesting . feel like watch first time caleb second nathan .,0
Mad Max: Fury Road,2015,davidehrlich,2015-05-11,"The fourth installment of George Miller's rambunctious postapocalyptic saga arrives in theaters like a tornado tearing through a tea party. In an age of weightless spectacles that studios whittle down from visions to products, here's a movie that feels like it was made by kidnapping $150 million of Warner Bros.' money, absconding with it to the Namibian desert, and sending footage back to Hollywood like the amputated body parts of a ransomed hostage.",6,2250,Action,"fourth installment george miller's rambunctious postapocalyptic saga arrives theater like tornado tearing tea party . age weightless spectacle studio whittle vision product , here's movie feel like made kidnapping $ 150 million warner bros . ' money , absconding namibian desert , sending footage back hollywood like amputated body part ransomed hostage .",0
Un Chien Andalou,1929,Doug,2015-05-20,There isn't even a fucking dog in this.,6,2668,Fantasy,even fucking dog .,0
Legally Blonde,2001,Bradley J. Dixon,2015-06-05,Browse through the Letterboxd reviews for  and you'll see people practically falling over themselves to make apologies for liking this film.,6,4623,Comedy,browse letterboxd review see people practically falling make apology liking film .,0
Ghost World,2001,kurt k,2015-06-06,steve buscemi is a manic pixie dream boy,6,4398,Comedy,steve buscemi manic pixie dream boy,0
Paprika,2006,DirkH,2015-06-06,Papurika = 8 lettersInception = 9 letters,44,3224,Animation,papurika = 8 lettersinception = 9 letter,0
A Trip to the Moon,1902,ScreeningNotes,2015-06-08,Some wacky scientists get medals and a commemorative statue for having a slumber party on the moon and disintegrating some of its local inhabitants with a magical umbrella.,6,2411,Adventure,wacky scientist get medal commemorative statue slumber party moon disintegrating local inhabitant magical umbrella .,0
Aliens,1986,Timcop,2015-08-02,"Did the math, and I do believe, on a purely technical level, Get away from her you !"" does in fact pass the Bechdel test.""""""",6,4382,Sci-Fi,"math , believe , purely technical level , get away ! "" fact pas bechdel test . "" "" """,0
It Follows,2014,Ava ???,2015-08-03,U KNOW WHAT?? I STILL DON'T KNOW WHAT THE FUCK THAT SEASHELL READER IS AND IT'S REALLY PISSING ME OFF!!!,28,4060,Horror,u know ? ? still know fuck seashell reader really pissing ! ! !,-1
The Wolf of Wall Street,2013,SilentDawn,2015-08-04,"3 hours of undiluted, insane, balls-out, coked-out, swift, ludicrous, hysterical, wacky, berserk, horrifying, paralyzing, unnerving, savage, bloodthirsty, untamed .",6,2624,Crime,"3 hour undiluted , insane , balls-out , coked-out , swift , ludicrous , hysterical , wacky , berserk , horrifying , paralyzing , unnerving , savage , bloodthirsty , untamed .",-1
Gone Girl,2014,Wesley R. Ball,2015-09-26,"Whenever I think about getting back together with my ex, I watch this film. Works like a charm every time.",6,10663,Mystery,"whenever think getting back together ex , watch film . work like charm every time .",0
Mean Girls,2004,Evan,2015-11-11,"If you claim to dislike this movie, stop lying to yourself.",16,0,Comedy,"claim dislike movie , stop lying .",-1
Citizen Kane,1941,Lucy,2015-12-06,"have you guys ever heard of this movie? citizen kane? directed by orson welles? ever heard of it? citizen kane? probably not, it's pretty indie",6,3660,Drama,"guy ever heard movie ? citizen kane ? directed orson welles ? ever heard ? citizen kane ? probably , pretty indie",0
The Empire Strikes Back,1980,Austin Gorski,2015-12-16,"Me: I love you.""""""""",3,269,Sci-Fi,": love . "" "" """,1
Carol,2015,Eli Hayes,2015-12-25,They should do an Audrey Hepburn biopic starring Rooney Mara.,63,2123,Romance,audrey hepburn biopic starring rooney mara .,0
High School Musical,2006,bri,2016-01-20,this > quentin tarantino and stanley kubrick's entire filmography combined,6,224,Drama,> quentin tarantino stanley kubrick's entire filmography combined,0
Scooby,2002,zoey luke,2016-02-03,No offense but this is the best movie ever made,10,0,Comedy,offense best movie ever made,1
Trainspotting,1996,feat. dante from the dmc series,2016-02-06,what the fuck was anyone saying,18,0,Drama,fuck anyone saying,-1
The Blair Witch Project,1999,matt lynch,2016-02-09,"It's maybe good that these guys got lost and eaten or whatever, because before stuff starts going wrong it seems like their documentary was probably going to suck.",3,4623,Horror,"maybe good guy got lost eaten whatever , stuff start going wrong seems like documentary probably going suck .",0
V for Vendetta,2005,zoey luke,2016-02-22,I love natalie Portman and I hate the government,8,0,Action,love natalie portman hate government,1
Cruel Intentions,1999,lolomcfloflo,2016-02-23,going to high school in the 90s must've been really tough with everyone being 25 and on coke,6,3222,Drama,going high school 90 must've really tough everyone 25 coke,0
Whiplash,2014,gabriel guimar??es?,2016-02-26,WHEREDID THE FOLDERGO,24,241,Drama,wheredid foldergo,0
Romeo & Juliet,1996,hesitant movie enjoyer,2016-03-04,if you hate this movie you suck and i dont wanna associate with your pretentious c??n??ph??l?? kind,26,0,Romance,hate movie suck dont wanna associate pretentious c ? ? n ? ? ph ? ? l ? ? kind,-1
Scooby-Doo 2: Monsters Unleashed,2004,Riley,2016-03-25,Much better than The Godfather,6,2993,Comedy,much better godfather,1
Whiplash,2014,feat. dante from the dmc series,2016-04-03,gotta add jazz to my list of irrational fears,4,0,Drama,gotta add jazz list irrational fear,-1
What We Do in the Shadows,2014,feat. dante from the dmc series,2016-04-04,"THE POINT, DEACON, IS THAT YOU HAVE NOT DONE THE DISHES FOR FIVE YEARS",6,650,Comedy,"point , deacon , done dish five year",0
Shrek 2,2004,Caitlin,2016-04-09,The scene where all the civilians are so terrified by the giant gingerbread man (RIP) that they run out of one Starbucks straight into another one that is literally right across the road is the most impressive and sophisticated comment on capitalism I have seen in any movie thus far also I really want a frappuccino like right now,10,4480,Animation,scene civilian terrified giant gingerbread man ( rip ) run one starbucks straight another one literally right across road impressive sophisticated comment capitalism seen movie thus far also really want frappuccino like right,0
My Own Private Idaho,1991,sydney,2016-04-14,never in my wildest dreams did i imagine that halfway between david lynch and TRUE STORIES was a devastating shakespeare adaptation about two angel-faced prostitutes on their quest to stop falling asleep long enough to find someone who cares...the  american dream,6,2420,Drama,never wildest dream imagine halfway david lynch true story devastating shakespeare adaptation two angel-faced prostitute quest stop falling asleep long enough find someone care ... american dream,0
Prisoners,2013,feat. dante from the dmc series,2016-05-06,i love paul dano but i also love watching people beat the shit out of paul dano,6,6961,Mystery,love paul dano also love watching people beat shit paul dano,1
Over the Garden Wall,2014,russman,2016-05-06,My ranking of the frog's many names:,6,204,Animation,ranking frog's many name :,0
The Ring,2002,BR??T,2016-05-06,"the story of a woman who only has  6   days to analyze the meaning of an avant-garde experimental art film. just take a cinema studies class, girl!",0,0,Horror,"story woman 6 day analyze meaning avant-garde experimental art film . take cinema study class , girl !",0
Notting Hill,1999,tara,2016-05-06,"working with leonardo."" """"....da vinci?""""""""""",4,0,Romance,"working leonardo . "" "" "" ... da vinci ? "" "" """,0
The Matrix Revolutions,2003,sydney,2016-05-08,"god is a black grandma, jesus is but an ambassador while women and black people do all the dirty work, the worst threat humanity has faced is the ever-expanding army of white men in business suits, love and hope are still the most powerful things in the universe. a miracle that this even exists.",14,2686,Sci-Fi,"god black grandma , jesus ambassador woman black people dirty work , worst threat humanity faced ever-expanding army white men business suit , love hope still powerful thing universe . miracle even exists .",0
Clueless,1995,isabelle ???,2016-05-14,is it incest? i still dont know,6,6146,Comedy,incest ? still dont know,0
The Lobster,2015,hesitant movie enjoyer,2016-05-22,"is there a bisexual option available?"" bitch! me too! the fuck!!!!!""""""",6,566,Drama,"bisexual option available ? "" bitch ! ! fuck ! ! ! "" "" """,-1
Interview with the Vampire,1994,feat. dante from the dmc series,2016-05-23,"don't think less of me for saying this but i would do terrible, disgusting things to 1994 tom cruise",31,2296,Horror,"think le saying would terrible , disgusting thing 1994 tom cruise",0
Stand by Me,1986,mememily,2016-06-03,gah damn i was just expecting a couple a punks runnin through the woods not this heartfelt emotional journey,6,2680,Drama,gah damn expecting couple punk runnin wood heartfelt emotional journey,0
Fight Club,1999,isabelle ???,2016-06-05,They Fought in that Club,6,2489,Drama,fought club,-1
Harry Potter and the Prisoner of Azkaban,2004,feat. dante from the dmc series,2016-06-06,"you tell those spiders, ron",1,0,Fantasy,"tell spider , ron",0
Edward Scissorhands,1990,feat. dante from the dmc series,2016-06-06,why did vincent price think it was okay to give this man scissors for hands,6,2626,Fantasy,vincent price think okay give man scissors hand,0
Jennifer’s Body,2009,Lucy,2016-06-18,invented feminism,6,6416,Horror,invented feminism,0
Jennifer’s Body,2009,Erik ????,2016-06-18,my tit,3,0,Horror,tit,0
The Witch,2015,BR??T,2016-06-25,thy lady didst that!,0,2168,Horror,thy lady didst !,0
Swiss Army Man,2016,Lucy,2016-06-30,"mary elizabeth winstead: what the fuck?""me: I KNOW""""""",10,2655,Comedy,"mary elizabeth winstead : fuck ? "" : know "" "" """,0
Psycho,1960,BR??T,2016-08-02,biggest twist of all time is that norman bates is hot,50,6444,Horror,biggest twist time norman bates hot,0
The Nice Guys,2016,hesitant movie enjoyer,2016-08-02,me every time ryan gosling made a high-pitched noise: now this is,6,6265,Comedy,every time ryan gosling made high-pitched noise :,0
Harry Potter and the Goblet of Fire,2005,????hayley????,2016-08-04,HARRY DID YA PIT YER NAM IN DA GOBLA AH FIRRRER,2,0,Fantasy,harry ya pit yer nam da gobla ah firrrer,0
Blue Valentine,2010,Caitlin,2016-08-05,I feel like relationships go one of two ways and it's either blue valentine or gone girl and I want no part in any of it,14,0,Drama,feel like relationship go one two way either blue valentine gone girl want part,0
Notting Hill,1999,kennedy,2016-08-12,love is real and it exists solely in hugh grant's hair,6,4388,Romance,love real exists solely hugh grant's hair,0
Unfriended,2014,Lucy,2016-08-18,do they know the computer has an off button,6,282,Horror,know computer button,0
Vertigo,1958,Leticia Fernandes,2016-08-19,Justice for Midge,6,2615,Mystery,justice midge,1
The Nice Guys,2016,feat. dante from the dmc series,2016-08-19,[high-pitched ryan gosling scream],2,0,Comedy,[ high-pitched ryan gosling scream ],0
The Devil Wears Prada,2006,indi,2016-08-29,"incredible how emily blunt plays a character called emily whose main characteristic is blunt."" one of many visionary elements in this seminal Masterpiece.""""""",1,6486,Comedy,"incredible emily blunt play character called emily whose main characteristic blunt . "" one many visionary element seminal masterpiece . "" "" """,0
Star Wars: Episode II,2002,BR??T,2016-08-29,"i'm convinced that anakin subconsciously used the force to make padme slowly fall in love with him because there's simply no way a queen/galactic senator would EVER get with a creepy, whiny child murderer with a mini ponytail",24,0,Sci-Fi,"i'm convinced anakin subconsciously used force make padme slowly fall love there's simply way queen / galactic senator would ever get creepy , whiny child murderer mini ponytail",0
Star Wars: Episode III,2005,BR??T,2016-08-30,more like obi-wan canboneme,13,0,Sci-Fi,like obi-wan canboneme,1
Pride & Prejudice,2005,kyra,2016-09-02,THE RAIN SCENE IS THE SINGLE MOST SEXUALLY CHARGED SCENE IN THE HISTORY OF THE MOVING IMAGE,8,0,Romance,rain scene single sexually charged scene history moving image,0
Moonlight,2016,davidehrlich,2016-09-03,"MOONLIGHT is *MAGNIFICENT.* a specific but utterly symphonic portrait of masculinity in the modern world. every shot is seared into my brain. it's also a devastatingly beautiful love story. to put it in the most reductive / tantalizing terms possible, think CAROL by way of Frank Ocean.",6,3009,Drama,"moonlight * magnificent . * specific utterly symphonic portrait masculinity modern world . every shot seared brain . also devastatingly beautiful love story . put reductive / tantalizing term possible , think carol way frank ocean .",0
Eternal Sunshine of the Spotless Mind,2004,#1 gizmo fan,2016-09-04,I pray people get broken up with so I can recommend this movie.,5,0,Romance,pray people get broken recommend movie .,1
She’s the Man,2006,Lia Allison,2016-09-08,had MULTIPLE opportunities to be a GAY FILM and DID NOT TAKE ANY OF THEM,8,3201,Comedy,multiple opportunity gay film take,0
What We Do in the Shadows,2014,hesitant movie enjoyer,2016-09-11,"i was doing an erotic dance for my friends, and you ruined it. i was in the zone. my friends were loving it.",0,0,Comedy,"erotic dance friend , ruined . zone . friend loving .",1
