movie_name,Release Year,Reviewer name,Clean_Review_date,Clean_Review,Clean_Comment Count,Like count,genre,Processed Review,Sentiment
Cats,2019,Mike Ginn,2019-12-28,"I kept thinking how funny it would be if I killed myself in the middle of the showing so I whispered to my girlfriend, 'you know what would be funny right now'? And she said, 'If you killed yourself'?",11,0,Musical,"kept thinking funny would killed middle showing whispered girlfriend , ' know would funny right ' ? said , ' killed ' ?",0
Little Women,2019,sophie,2019-12-29,"i will cast the march sisters perfectly and make them do intense research into their roles, they will embody their charactersfuck it, bob odenkirk as the dad",25,4155,Drama,"cast march sister perfectly make intense research role , embody charactersfuck , bob odenkirk dad",0
The Handmaiden,2016,kyle,2019-12-29,"scamming men, falling in love, destroying property... i want what they have",1,2380,Drama,"scamming men , falling love , destroying property ... want",1
Ready or Not,2019,Roberto_,2020-01-02,spreading antirich propaganda in 2019,6,2088,Horror,spreading antirich propaganda 2019,0
American Psycho,2000,persia ????,2020-01-06,dorsia was the real villain all along,6,6690,Thriller,dorsia real villain along,-1
The Social Network,2010,sree,2020-01-09,literally why did david fincher turn the plot of the invention of facebook into a gay drama like what was the reason,6,6568,Drama,literally david fincher turn plot invention facebook gay drama like reason,0
Come and See,1985,IHE,2020-01-09,What a horrible nightmare!,6,3583,War,horrible nightmare !,-1
Uncut Gems,2019,Jay,2020-01-11,arno: we saw you were placing bets with my money,6,2136,Drama,arno : saw placing bet money,0
Aftersun,2022,Tuomas,2020-01-12,This review may contain spoilers.,130,22446,Drama,review may contain spoiler .,0
Four Weddings and a Funeral,1994,ty,2020-01-12,"Oh, look at me... I'm Hugh Grant, I have perfect bone structure and kind eyes. Go fuck yourself Hugh Grant.",6,235,Romance,"oh , look ... i'm hugh grant , perfect bone structure kind eye . go fuck hugh grant .",1
Once Upon a Time in Hollywood,2019,k??rsten,2020-01-12,Still don't think it's close to being best picture worthy but it hits dramatically different when you're??1. living in Los Angeles2. very drunk,55,0,Drama,still think close best picture worthy hit dramatically different ? ? 1 . living los angeles 2 . drunk,0
Little Women,2019,mulaney,2020-01-12,[screams] AND I'VE NEVER FELT MORE ALONE IT FEELS SO SCARY GETTING OLD!!!!!!!!!!!!,6,0,Drama,[ scream ] i've never felt alone feel scary getting old ! ! !,-1
American Psycho,2000,?????? Liam ??????,2020-01-14,**DERMOTOLOGIST APPROVED** Get Ready With Me | PATRICK BATEMAN Skincare Routine (HONEST NOT SPONSORED) #skincareroutine #getthepsycholook #patrickbateman,6,842,Thriller,* * dermotologist approved * * get ready | patrick bateman skincare routine ( honest sponsored ) #skincareroutine #getthepsycholook #patrickbateman,0
The Lighthouse,2019,Esther Rosenfield,2020-01-15,This review may contain spoilers.,63,1882,Horror,review may contain spoiler .,0
The Silence of the Lambs,1991,Patrick Willems,2020-01-15,"Oh I love this scene!"" - me every time a new scene starts""""""",6,2432,Thriller,"oh love scene ! "" - every time new scene start "" "" """,0
Uncut Gems,2019,IHE,2020-01-16,What a ride,33,0,Drama,ride,0
10 Things I Hate About You,1999,aliyah,2020-01-18,"funny how shakespeare's been real quiet since joseph gordon-levitt said 'i burn, i pine, i perish'",6,6456,Romance,"funny shakespeare's real quiet since joseph gordon-levitt said ' burn , pine , perish '",0
The King of Comedy,1982,#1 gizmo fan,2020-01-18,todd phillips is rupert pupkin,15,0,Comedy,todd phillips rupert pupkin,0
The Gentlemen,2019,Jim Caddick,2020-01-19,Hugh Grant was in Paddington 2 and now he says 'cunt' 200 times,11,3446,Action,hugh grant paddington 2 say ' cunt ' 200 time,0
Back to the Future,1985,Patrick Willems,2020-01-20,"When they all shout SHIT"" and then get shit dumped on them? That's cinema. 5/5. Perfect.""""""",12,0,Adventure,"shout shit "" get shit dumped ? that's cinema . 5/5 . perfect . "" "" """,-1
Chungking Express,1994,?????? Liam ??????,2020-01-22,all the leaves are brown ''? ''?? '''''? ''?? ''''?and the sky is grey ''' ''?? ''? '?? '''?,5,0,Drama,leaf brown ' ' ? ' ' ? ? ' ' ' ? ' ' ? ? ' ' ' ? sky grey ' ' ' ' ' ? ? ' ' ? ' ? ? ' ' ' ?,0
Uncut Gems,2019,Matt Singer,2020-01-23,"It's just too bad not a single member of the Academy watched this movie. If they had, Sandler would have been the first unanimous choice for Best Actor in the history of the Oscars. What a waste.",6,2651,Drama,"bad single member academy watched movie . , sandler would first unanimous choice best actor history oscar . waste .",0
Avatar,2009,Mike Ginn,2020-01-25,"Through a biotech miracle, a white guy gets to have dreads",38,6440,Sci-Fi,"biotech miracle , white guy get dread",0
Ready or Not,2019,aliyah,2020-01-26,"in the name of the father (parasite), the son (knives out) and the holy spirit (ready or not)",6,414,Horror,"name father ( parasite ) , son ( knife ) holy spirit ( ready )",0
Parasite,2019,k??rsten,2020-01-26,"Watched with a live orchestra and an introduction by Bong. It was one of my favorite experiences at a theatre, obviously.",6,4068,Thriller,"watched live orchestra introduction bong . one favorite experience theatre , obviously .",0
But I’m a Cheerleader,1999,aliyah,2020-01-28,when they're talking about what their 'homosexual roots' are and one of the girls says 'i was born in france'... yeah,1,0,Comedy,they're talking ' homosexual root ' one girl say ' born france ' ... yeah,0
Little Women,2019,Jay,2020-01-28,laurie when he sees friedrich: whos mans is this?,3,0,Drama,laurie see friedrich : who man ?,0
American Psycho,2000,alex todd ?????????????,2020-01-30,gotta respect a man with a hobby,1,4128,Thriller,gotta respect man hobby,1
Joker,2019,Lucy,2020-02-01,best picture showcase: film #2,284,2408,Crime,best picture showcase : film # 2,1
Punch,2002,BR??T,2020-02-05,"the hushed, conspiratorial way that adam sandler raves about the pudding promotion seeming too good of a deal to be true is the same way i used to talk about moviepass (RIP) </3",22,2202,Comedy,"hushed , conspiratorial way adam sandler raf pudding promotion seeming good deal true way used talk moviepass ( rip ) </3",0
Gone Girl,2014,IHE,2020-02-06,Definitely one to watch with the SO!,33,0,Mystery,definitely one watch !,1
Birds of Prey (and the Fantabulous Emancipation of One Harley Quinn),2020,deah,2020-02-06,Harley: well well well. if it isn't the consequences for my actions,3,0,Action,harley : well well well . consequence action,1
Little Women,2019,maria,2020-02-08,i relate to jo march i relate to jo march i relate to jo march i relate to jo march i relate to jo march,12,0,Drama,relate jo march relate jo march relate jo march relate jo march relate jo march,0
Parasite,2019,maria,2020-02-10,"I'M SCREAMING I'M CRYING THIS IS THE BEST SHIT THAT HAS EVER HAPPENED THE FILM THAT TRULY MADE ME A CINEPHILE IS THE FIRST FOREIGN FILM TO EVER WIN BEST PICTURE WE WON bong can now finally go and drink his guts out, bless his heart",0,2661,Thriller,"i'm screaming i'm cry best shit ever happened film truly made cinephile first foreign film ever win best picture bong finally go drink gut , bless heart",0
Fight Club,1999,abigail.,2020-02-11,why does jared leto show up in every good movie just long enough to ruin it,18,3325,Drama,jared leto show every good movie long enough ruin,0
Portrait of a Lady on Fire,2019,demi adejuyigbe,2020-02-12,catch me at the amc burbank 16 having a strong emotional reaction to a bunch of women suddenly singing the thx logo music,22,2299,Romance,catch amc burbank 16 strong emotional reaction bunch woman suddenly singing thx logo music,0
Memories of Murder,2003,kayla,2020-02-13,I love when the dude in this just dropkicks everyone,6,930,Crime,love dude dropkick everyone,1
Sonic the Hedgehog,2020,Nicole Kubrick ??????????????????????????????,2020-02-13,tarantino during the scene where jim carrey analyzes sonic's footprint be like 'this is my black panther',8,2639,Action,tarantino scene jim carrey analyzes sonic's footprint like ' black panther ',0
Memories of Murder,2003,hollie amanda,2020-02-13,just call me bong joon's ho,6,2091,Crime,call bong joon's ho,0
Emma.,2020,stevie,2020-02-14,I'm blonde I'm skinny I'm rich and I'm a little bit of a bitch,6,9311,Romance,i'm blonde i'm skinny i'm rich i'm little bit bitch,0
Emma.,2020,saffron,2020-02-14,you: oh I remember this scene from the book,6,6584,Romance,: oh remember scene book,0
American Psycho,2000,siobhan,2020-02-18,i love how willem dafoe has been the same age for 20 years,6,6652,Thriller,love willem dafoe age 20 year,0
The Invisible Man,2020,Chris Evangelista,2020-02-18,"Someone give Elisabeth Moss a nice, relaxing rom com",6,856,Horror,"someone give elisabeth moss nice , relaxing rom com",0
The Dark Knight,2008,Lucy,2020-02-18,the best superhero movie ever made. period,134,0,Action,best superhero movie ever made . period,0
Birds of Prey (and the Fantabulous Emancipation of One Harley Quinn),2020,Lucy,2020-02-19,my only complaint is that it's not long enough,6,2292,Action,complaint long enough,-1
Ex Machina,2014,David Chen,2020-02-22,'You tore up her picture!''I'm gonna tear up this fucking dance floor dude. Check it out.',16,6582,Sci-Fi,' tore picture ! ' ' i'm gonna tear fucking dance floor dude . check . ',0
My Neighbor Totoro,1988,maria,2020-02-23,IS THIS WHAT HAPPINESS FEELS LIKE'??,6,9,Animation,happiness feel like ' ? ?,1
Dazed and Confused,1993,maria,2020-02-23,matthew mcconaughey waltzing in there 40 minutes late with that bob marley shirt and those motherfucking blonde bangs  the place...,6,0,Comedy,matthew mcconaughey waltzing 40 minute late bob marley shirt motherfucking blonde bang place ...,0
Crash,1996,amanda :(,2020-02-24,vanilla sex?? ?? ?? ?? ?? ?? ??is too boring.,15,4668,Drama,vanilla sex ? ? ? ? ? ? ? ? ? ? ? ? ? ? boring .,-1
Fantastic Mr. Fox,2009,?????? Liam ??????,2020-02-25,willem dafoe as willem da rat,21,668,Animation,willem dafoe willem da rat,0
The Invisible Man,2020,Hannah,2020-02-25,Even when men are invisible they're causing fuckin problems. Stay where we can see you fuckers,12,0,Horror,even men invisible they're causing fuckin problem . stay see fucker,0
Ponyo,2008,Holli,2020-02-28,me: :(ponyo: splish splash i want hamme: :),1,3622,Animation,: :( ponyo : splish splash want hamme : :),1
Eyes Wide Shut,1999,hunt??r,2020-03-01,1999: a sex odyssey,3,2141,Drama,1999 : sex odyssey,0
The Invisible Man,2020,BR??T,2020-03-02,"mixed feelings about this one! LOVE the decision to plumb horror from the deadly frustration of not being believed ' thing is, other movies have pulled it off with greater precision (, , even ), and i think it's because they're more character focused.",30,0,Horror,"mixed feeling one ! love decision plumb horror deadly frustration believed ' thing , movie pulled greater precision ( , , even ) , think they're character focused .",0
Emma.,2020,kate???s bush,2020-03-03,emma:,6,10611,Romance,emma :,0
The Invisible Man,2020,Patrick Willems,2020-03-03,The utter hopelessness of the situation the main character is put in is one of the scariest things I've seen in a movie in years,8,2450,Horror,utter hopelessness situation main character put one scariest thing i've seen movie year,0
Little Miss Sunshine,2006,Lucy,2020-03-05,"one of my all time favorites, and it never gets old. this is one of the examples i always reference when asked about my favorite dialogue in film",8,0,Comedy,"one time favorite , never get old . one example always reference asked favorite dialogue film",0
Emma.,2020,erika,2020-03-05,"all of the hand touches.... i am unworthy, i am nothing",6,2446,Drama,"hand touch ... unworthy , nothing",1
Brokeback Mountain,2005,ellie ???,2020-03-06,"yes, i'm 99% sure the foreman was a homophobe who turned jack away that second summer for homophobic reasons. but there's a tiny part of my brain that refuses to dismiss the possibility that he really just wanted sheep-herders who would watch over the sheep instead of fucking",6,2668,Romance,"yes , i'm 99 % sure foreman homophobe turned jack away second summer homophobic reason . there's tiny part brain refuse dismiss possibility really wanted sheep-herders would watch sheep instead fucking",0
La La Land,2016,demi adejuyigbe,2020-03-09,I enjoy the 2016 Damien Chazelle film .,6,4606,Musical,enjoy 2016 damien chazelle film .,0
The Perks of Being a Wallflower,2012,aliyah,2020-03-09,sometimes a good film is just logan lerman carrying the weight of my sadness on his shoulders whilst i cry so hard i think i'm going to pass out,0,0,Drama,sometimes good film logan lerman carrying weight sadness shoulder whilst cry hard think i'm going pas,0
Emma.,2020,tyler,2020-03-09,you art thou a virgin who cannot drive,1,2610,Drama,art thou virgin cannot drive,0
Emma.,2020,Lucy,2020-03-10,"no i wasn't thinking about clueless the entire run time, how dare you slander my name with such a heinous accusation",6,2646,Drama,"thinking clueless entire run time , dare slander name heinous accusation",0
Neon Genesis Evangelion,1995,Violet,2020-03-12,People who don't like the last two episodes are fucking lame,6,4165,Animation,people like last two episode fucking lame,0
The Grand Budapest Hotel,2014,aaron,2020-03-14,not to be dramatic or anything but I would die to live in a wes anderson film,6,2664,Comedy,dramatic anything would die live wes anderson film,0
Persona,1966,sam,2020-03-18,me with my two brain cells: haha they're lesbians. '',11,3926,Drama,two brain cell : haha they're lesbian . ' ',0
Star Wars: The Rise of Skywalker,2019,IHE,2020-03-19,It just gets worse.,6,3614,Sci-Fi,get worse .,-1
Emma.,2020,Muriel,2020-03-20,"emma and harriet should've ended up together, in this essay i will",8,4103,Drama,"emma harriet ended together , essay",0
The Platform,2019,hollie amanda,2020-03-20,the communist maniFEASTo,28,0,Thriller,communist manifeasto,0
Top Gun,1986,Jack Attack,2020-03-20,This is just Call Me by Your Name except the peaches are replaced with jets that go really fucking fast.,6,2485,Action,call name except peach replaced jet go really fucking fast .,0
The Hunt,2020,clementine,2020-03-20,me vs trying to figure out what side of the political spectrum this movie is on,6,2331,Horror,v trying figure side political spectrum movie,0
Interstellar,2014,siobhan,2020-03-21,watched on my 13 inch macbook air just as christopher nolan intended <3,6,2608,Sci-Fi,watched 13 inch macbook air christopher nolan intended <3,0
Shrek 2,2004,hunt??r,2020-03-22,are we gonna talk about how puss in boots called the police 'capitalist pig dogs'?,3,2621,Animation,gonna talk pus boot called police ' capitalist pig dog ' ?,0
Emma.,2020,maria,2020-03-22,"shoutout to me for pointing at the screen and screaming, alone in my room, every time a beautiful frame was shown  which was like... every 30 seconds",12,0,Drama,"shoutout pointing screen screaming , alone room , every time beautiful frame shown like ... every 30 second",0
When Harry Met Sally...,1989,andrea,2020-03-24,the only bad thing about this movie is that it made me attracted to billy crystal,13,2111,Romance,bad thing movie made attracted billy crystal,0
Magnolia,1999,amaya,2020-03-25,when tom cruise yelled RESPECT THE COCK!! i thought oh okay this is going to be fun and then i cried for 2 hours,11,0,Drama,tom cruise yelled respect cock ! ! thought oh okay going fun cried 2 hour,1
Diary of a Wimpy Kid: Rodrick Rules,2011,val,2020-03-28,the way greg suffered more than joker in this movie,2,0,Comedy,way greg suffered joker movie,-1
The Platform,2019,Lucy,2020-03-30,location: underneath jeff bezos' house,22,0,Thriller,location : underneath jeff bezos ' house,0
The Perks of Being a Wallflower,2012,kayla,2020-04-01,Makes you so sad and happy and comforted all at the same time,2,0,Drama,make sad happy comforted time,1
The Perks of Being a Wallflower,2012,lauren,2020-04-02,why don't you go and scroll through 2012-2014 tumblr and try and tell me this a complete cultural reset? we  infinite!!!! bitch!!!!!,9,0,Drama,go scroll 2012-2014 tumblr try tell complete cultural reset ? infinite ! ! ! bitch ! ! !,0
The Talented Mr. Ripley,1999,owen,2020-04-05,fellas is it gay to steal your homie's identity?,1,0,Drama,fella gay steal homie's identity ?,0
Buffalo ’66,1998,hollie amanda,2020-04-06,"let's not forget about the real star of the film, christina ricci's blue eyeshadow",8,0,Drama,"let's forget real star film , christina ricci's blue eyeshadow",0
Possession,1981,Penny,2020-04-08,Somebody get this bitch a Xanax,6,3325,Horror,somebody get bitch xanax,-1
Rocketman,2019,Patrick Willems,2020-04-08,The pitch: what if Bohemian Rhapsody was not bad?,6,2663,Biography,pitch : bohemian rhapsody bad ?,-1
Friday the 13th,1980,Patrick Willems,2020-04-09,A very violent Scooby-Doo episode,16,2661,Horror,violent scooby-doo episode,-1
Uncut Gems,2019,k??rsten,2020-04-10,'I mean what the hell is wrong with The Academy'? ~ my mom,68,4446,Drama,' mean hell wrong academy ' ? ~ mom,-1
Top Gun,1986,maria,2020-04-10,may i offer my scientific assessment? not gay enough,13,3648,Action,may offer scientific assessment ? gay enough,0
Breathless,1960,maria,2020-04-14,toes are important in a girl '''''''''''''? good shit go'?? sHit'? thats ' some good''??shit right''??there'''' right'there ''if i do ??a?? so my self '? i say so '? thats what im talking about right there right there (chorus: ''''? ''''?) mMMMM''' ''?? ''O0'??OOOOO''??Oooo''''''''''? ''?? '? '? '? '? '? '? ''??Good shit,18,3456,Crime,toe important girl ' ' ' ? good shit go ' ? ? shit ' ? thats ' good ' ' ? ? shit right ' ' ? ? ' ' ' right'there ' ' ? ? ? ? self ' ? say ' ? thats im talking right right ( chorus : ' ' ' ? ' ' ' ? ) mmmmm ' ' ' ' ' ? ? ' ' o0 ' ? ? ooooo ' ' ? ? oooo ' ' ' ? ' ' ? ? ' ? ' ? ' ? ' ? ' ? ' ? ' ' ? ? good shit,0
The Perks of Being a Wallflower,2012,nick,2020-04-14,"charlie, sam, and patrick...i love you.....but how the fuck did you not know a david bowie song",5,0,Drama,"charlie , sam , patrick ... love ... fuck know david bowie song",0
Suspiria (2018),2018,Lucy,2020-04-18,who needs to understand what the fuck is going on when the vibes are this good,23,6485,Horror,need understand fuck going vibe good,0
We Need to Talk About Kevin,2011,maria,2020-04-18,they should have talked about kevin a,9,0,Drama,talked kevin,0
Scarface,1983,Patrick Willems,2020-04-18,That mountain of cocaine on Tony's desk? That's a metaphor for what the entire movie feels like,6,2668,Crime,mountain cocaine tony's desk ? that's metaphor entire movie feel like,0
Star Wars: The Rise of Skywalker,2019,James (Schaffrillas),2020-04-22,I take back every mean thing I ever said about Attack of the Clones.,128,0,Sci-Fi,take back every mean thing ever said attack clone .,0
Kill Bill: Vol. 1,2003,clementine,2020-04-24,tarantino's casting call for this like 'bad bitches only '''''''''?,6,869,Action,tarantino's casting call like ' bad bitch ' ' ' ?,-1
Twilight,2008,#1 gizmo fan,2020-04-25,it's free serotonin,4,0,Romance,free serotonin,1
Coraline,2009,aaron,2020-04-25,I'm in complete awe of how every single frame is a literal work of art,5,0,Animation,i'm complete awe every single frame literal work art,0
Normal People,2020,yazz! *?????????,2020-04-30,"if you're lonely and horny, this is the worst thing you could watch. do Not do it.",30,663,Drama,"lonely horny , worst thing could watch . .",-1
The Half of It,2020,eva,2020-05-01,lovely but not gay enough,40,0,Romance,lovely gay enough,1
The Half of It,2020,aliyah,2020-05-01,well damn can i get another half of it because i didn't want it to end,6,2483,Romance,well damn get another half want end,0
The Half of It,2020,vince,2020-05-02,this is the type of film noah centineo would star in and i'm so glad he didn't,26,0,Romance,type film noah centineo would star i'm glad,0
The Half of It,2020,james????,2020-05-02,okay but what's Mr. Chu's Letterboxd,12,0,Romance,okay what's mr . chu's letterboxd,0
Harry Potter and the Half-Blood Prince,2009,???? lindsay ????,2020-05-02,Harry has more chemistry with the giant dead spider than he does with Ginny,21,3128,Fantasy,harry chemistry giant dead spider ginny,0
Normal People,2020,alex,2020-05-02,"so much of this is just him looking at her, trying to look at her, looking for her",5,2623,Drama,"much looking , trying look , looking",0
Emma.,2020,Jay,2020-05-04,even in the rare occasion a period romance doesnt star keira they managed to squeeze the name 'knightley' in there,6,156,Drama,even rare occasion period romance doesnt star keira managed squeeze name ' knightley ',0
Normal People,2020,sam,2020-05-04,do you believe no one's gonna ever love you and you'll die alone because of your insecurities that you'll never be enough for someone or are you normal?,6,0,Drama,believe one's gonna ever love die alone insecurity never enough someone normal ?,-1
Normal People,2020,erika,2020-05-05,not to be dramatic but i am never going to get over this emotionally,12,0,Drama,dramatic never going get emotionally,0
Top Gun,1986,Jacob Elijah Tucker,2020-05-06,this film is very unrealistic because Tom Cruise does not meet the height requirement to be a pilot,11,0,Action,film unrealistic tom cruise meet height requirement pilot,0
The Hunger Games,2012,aaron,2020-05-06,book to film adaptations just don't hit as hard as this anymore,6,2453,Action,book film adaptation hit hard anymore,0
Donnie Darko,2001,Will,2020-05-06,"No film has the right to have a soundtrack like this... Tears for Fears, Echo & the Bunnymen, Joy Division and Duran Duran...",14,0,Sci-Fi,"film right soundtrack like ... tear fear , echo & bunnymen , joy division duran duran ...",0
The Truman Show,1998,vince,2020-05-08,the truman show was black mirror before black mirror was black mirror,6,4636,Drama,truman show black mirror black mirror black mirror,0
The Lord of the Rings: The Two Towers - **Fantasy**,2002,Roberto_,2020-05-11,cultural impact:,6,3635,Fantasy,cultural impact :,0
Brokeback Mountain,2005,Syaoran,2020-05-11,Today I learned that Heath Ledger refused to present at Oscars due to homophobic jokes about this film.,1,2366,Romance,today learned heath ledger refused present oscar due homophobic joke film .,0
Mean Girls,2004,Lucy,2020-05-12,i still remember the specific feeling of being 10 years old and watching this for the first time. i thought 'this is the best movie i've ever seen in my life' and that's still true,29,959,Comedy,still remember specific feeling 10 year old watching first time . thought ' best movie i've ever seen life ' that's still true,0
Twilight,2008,?????????Lily???????,2020-05-12,Robert Pattinson wasn't acting that's just how he is in real life,15,2688,Romance,robert pattinson acting that's real life,0
The Life Aquatic with Steve Zissou,2004,Muriel,2020-05-12,willem dafoe in shorts is my favorite willem dafoe,1,2093,Adventure,willem dafoe short favorite willem dafoe,0
When Marnie Was There,2014,clementine,2020-05-20,i thought they were...you know....until i found out they were...you know...,21,0,Animation,thought ... know ... found ... know ...,0
Back to the Future,1985,matt lynch,2020-05-20,So structurally perfect that it may have eventually ruined movies.,0,0,Adventure,structurally perfect may eventually ruined movie .,0
They Live,1988,k??rsten,2020-05-21,real eyes realize real lies........,25,0,Sci-Fi,real eye realize real lie ...,0
Gone Girl,2014,Patrick Willems,2020-05-22,These people are such sacks of shit! I love it!,6,2388,Mystery,people sack shit ! love !,1
The Hunger Games: Mockingjay - Part 2,2015,sree,2020-05-24,peeniss forever <3,6,2646,Action,peeniss forever <3,1
Howl’s Moving Castle,2004,k??rsten,2020-05-26,When Howl unintentionally dyes his hair orange. Hey man we've all been there!,6,4268,Animation,howl unintentionally dye hair orange . hey man we've !,0
Jurassic Park,1993,demi adejuyigbe,2020-05-29,Honestly would've been fine if they  did the park with the herbivores. I think they should give it another shot!,13,2362,Adventure,honestly would've fine park herbivore . think give another shot !,0
The Social Network,2010,sree,2020-06-06,jesse eisenberg's super punchable face really elevates the whole experience,10,0,Drama,jesse eisenberg's super punchable face really elevates whole experience,0
Parasite,2019,Lucy,2020-06-06,"anyways, when you guys are eating the rich, which condiment are you choosing? i'm a ketchup girl myself",69,2193,Thriller,"anyways , guy eating rich , condiment choosing ? i'm ketchup girl",0
Spider,2004,travis k,2020-06-08,"the virgin amazing spider-man:- responsibility, no power- listens to phillip phillips unironically- shares diluted to 0.03%- skater- has never seen a girl",44,0,Action,"virgin amazing spider-man : - responsibility , power - listens phillip phillips unironically - share diluted 0.03 % - skater - never seen girl",0
365 Days,2020,els! ???? ????,2020-06-09,i think i wrote something similar to this when i was 15 on wattpad,25,948,Romance,think wrote something similar 15 wattpad,0
Se7en,1995,aaron,2020-06-12,Barbara Minerva: I used to be a nerd who nobody liked but now I am hot and bulletproof and can pull off Robert Smith-levels of eyeliner.,6,11261,Thriller,barbara minerva : used nerd nobody liked hot bulletproof pull robert smith-levels eyeliner .,0
Artemis Fowl,2020,Patrick Willems,2020-06-12,Ireland should prosecute Kenneth Branagh for war crimes,56,3362,Adventure,ireland prosecute kenneth branagh war crime,-1
My Neighbor Totoro,1988,BR??T,2020-06-15,Totoro has leaf on head : ),6,865,Animation,totoro leaf head : ),0
School of Rock,2003,k??rsten,2020-06-15,Why did I cry?,6,3628,Comedy,cry ?,-1
Bridget Jones’s Diary,2001,k??rsten,2020-06-20,Hugh Grant's hair is a character in itself.,13,0,Romance,hugh grant's hair character .,0
