movie_name,Release Year,Reviewer name,Clean_Review_date,Clean_Review,Clean_Comment Count,Like count,genre,Processed Review,Sentiment
Thor,2022,Lucy,2022-06-06,almost 30 feature length entries into this franchise and now it feels to me like the human brain can only really take in so many of these generic deep fried mega tentpole adventures before it starts to collapse in on itself and now they don't really look like much of anything anymore and aren't very distinguishable from each other regardless of content. i shouldn't be zoning out every single movie during the most high energy fight scenes. this was fine! but are we done?,46,164,Action,almost 30 feature length entry franchise feel like human brain really take many generic deep fried mega tentpole adventure start collapse really look like much anything anymore distinguishable regardless content . zoning every single movie high energy fight scene . fine ! done ?,0
Thor,2022,sophie,2022-06-06,i like to dissect gods. did you know i'm utterly insane?,6,53,Action,like dissect god . know i'm utterly insane ?,1
Thor,2022,demi adejuyigbe,2022-06-06,cancer driven story with a bunch of kids and a literal make-a-wish plot. a feature length commercial for st. jude's,25,0,Action,cancer driven story bunch kid literal make-a-wish plot . feature length commercial st . jude's,0
The Sea Beast,2022,Brian Tallerico,2022-06-06,How to Train Your Moana of the Caribbean,12,0,Animation,train moana caribbean,0
Mamma Mia!,2008,k??rsten,2019-06-16,"The music. The magic. The energy. Folks, this is what the movies are all about.",36,2319,Musical,"music . magic . energy . folk , movie .",0
Inception,2010,Patrick Willems,2020-06-16,Dom Cobb seems like he's never told a joke in his life and has zero friends,6,3335,Sci-Fi,dom cobb seems like he's never told joke life zero friend,0
Legally Blonde,2001,molly,2021-06-16,elle woods was at harvard at the same time as mark zuckerberg,6,3643,Comedy,elle wood harvard time mark zuckerberg,0
Black Widow,2021,davidehrlich,2021-06-16,I personally think *all* movies should be set between the end of Captain America: Civil War and the post-credits scene of Captain America: Civil War.,0,2698,Action,personally think * * movie set end captain america : civil war post-credits scene captain america : civil war .,0
Where the Crawdads Sing,2022,???? lindsay ????,2022-06-16,This is a small and stupid detail but if she grew up completely isolated in the marsh away from society why does she have curtain bangs,40,6098,Drama,small stupid detail grew completely isolated marsh away society curtain bang,0
Legally Blonde,2001,scoobert doo (aka mo),2016-06-01,"'there's a moment in this film?? where elle woods goes to a nail salon and is telling her new gal pal paulette all about her misfortunes. during this bonding session she says i even hired a coppola to do my admissions video"" and i can honestly say i'll never rest until i know which one it was. was it sofia' gia' roman' WAS IT FUCKING FRANCIS' WHO DID IT? WHO WAS GIVEN THE HONOR TO WORK WITH ELLE?? WHO HAD THE BRAGGING RIGHTS FOR THE 2001 COPPOLA CHRISTMAS''??""""""",6,2380,Comedy,"' there's moment film ? ? elle wood go nail salon telling new gal pal paulette misfortune . bonding session say even hired coppola admission video "" honestly say i'll never rest know one . sofia ' gia ' roman ' fucking francis ' ? given honor work elle ? ? bragging right 2001 coppola christmas ' ' ? ? "" "" """,0
The Holiday,2006,allison,2016-06-01,HOT SENSITIVE SINGLE DAD IN GLASSES JUDE LAW IS PEAK MALE ATTRACTIVENESS,6,53,Romance,hot sensitive single dad glass jude law peak male attractiveness,0
Scream,1996,Hannah,2018-06-01,1. don't pick up the phone,6,4169,Horror,1 . pick phone,0
Dead Poets Society,1989,cait,2018-06-01,"the main thing I love about this film is how it shows the importance of studying art, literature and creative subjects/degrees and how damaging it can be to belittle something that someone loves and it passionate about. a film that everyone should watch",9,0,Drama,"main thing love film show importance studying art , literature creative subject / degree damaging belittle something someone love passionate . film everyone watch",1
The Place Beyond the Pines,2012,Jay,2020-06-01,"ryan gosling be like i know a place"" and its beyond the pines""""""",21,2634,Crime,"ryan gosling like know place "" beyond pine "" "" """,0
The Blair Witch Project,1999,Lucy,2020-06-01,finally raising my rating to 5 stars because found footage horror begins and ends here. this is literally the blueprint and i don't think anything will ever top this super specific kind of scary,26,2161,Horror,finally raising rating 5 star found footage horror begin end . literally blueprint think anything ever top super specific kind scary,0
Minions: The Rise of Gru,2022,k??rsten,2022-06-01,shoutout to gru and them,0,4666,Animation,shoutout gru,0
Minions: The Rise of Gru,2022,Jake,2022-06-01,I want to sleep with them but not inappropriately like I just wanna snuggle with them and hug them and kiss them make sure they are okay,51,0,Animation,want sleep inappropriately like wanna snuggle hug kiss make sure okay,1
Howl's Moving Castle,2004,sai,2016-06-10,sophie walking into howl's castle for the first time: damn bitch you live like this?,6,9662,Animation,sophie walking howl's castle first time : damn bitch live like ?,0
Snowpiercer,2013,Matt Singer,2014-06-10,The best Captain America movie of the year.,6,2611,Action,best captain america movie year .,1
The Strange Thing About the Johnsons,2011,Jay,2018-06-10,"imagine youre dating ari aster and he says i want to start a family with you"" after seeing this and hereditary you know id bolt the fuck out of the front door before the paimon possesses my unborn children""""""",6,2426,Drama,"imagine youre dating ari aster say want start family "" seeing hereditary know id bolt fuck front door paimon posse unborn child "" "" """,0
Midsommar,2019,Ralph,2019-06-10,"Still days after seeing it I'm stunned. Excellent acting, cinematography, score, editing; steers clear of horror cliches and stereotypes. Check this out as soon as you can because it's a truly unique and disturbing experience.",56,2166,Horror,"still day seeing i'm stunned . excellent acting , cinematography , score , editing ; steer clear horror cliche stereotype . check soon truly unique disturbing experience .",0
Thor,2022,k??rsten,2022-06-10,absolute dogshit movie,6,6695,Action,absolute dogshit movie,0
Marcel the Shell with Shoes On,2021,Jack Mayer,2022-06-10,When the kush hits hard,4,239,Animation,kush hit hard,0
Pride & Prejudice,2005,shannon,2016-06-11,funny how this is the height of the romance genre and yet no one even kisses.... the steamiest thing in the movie is those 'excellent boiled potatoes',6,9333,Romance,funny height romance genre yet one even kiss ... steamiest thing movie ' excellent boiled potato ',1
Howl’s Moving Castle,2004,shay,2016-06-11,howl made sophie a portal to a valley he knew she'd love and i can't even get a text back,15,388,Animation,howl made sophie portal valley knew she'd love can't even get text back,0
Breakfast at Tiffany’s,1961,sarah,2016-06-11,can you imagine how perfect this film would be without all the racism,62,0,Romance,imagine perfect film would without racism,1
Prisoners,2013,andrea????,2016-06-11,i didnt breathe for 2 hours 33 mins 12 secs,5,0,Mystery,didnt breathe 2 hour 33 min 12 sec,0
Under the Skin,2013,k??rsten,2018-06-11,Never in a million years did I think a movie that would make me contemplate my existence would also have Darude - Sandstorm in it.,6,2463,Sci-Fi,never million year think movie would make contemplate existence would also darude - sandstorm .,0
But I’m a Cheerleader,1999,k??rsten,2019-06-11,"I scream laughed at 'this is my son, Rock.'??protect this movie at all costs holy fuck",10,2439,Comedy,"scream laughed ' son , rock . ' ? ? protect movie cost holy fuck",-1
Midsommar,2019,Jay,2019-06-11,the boyfriend in midsommar (off-screen): dont kill yourself youre so sexy haha,6,2286,Horror,boyfriend midsommar ( off-screen ): dont kill youre sexy haha,1
Palm Springs,2020,Roberto_,2020-06-11,"what if we held hands while hallucinating dinosaurs in the desert during a starry night....... and as we're stuck in a time loop together....... ahaha, just kidding....... unless......??",2,333,Comedy,"held hand hallucinating dinosaur desert starry night ... we're stuck time loop together ... ahaha , kidding ... unless ... ? ?",0
Marcel the Shell with Shoes On,2021,drewphillips09,2022-06-11,I genuinely cried the entire movie LMAOIm considering this a war crime' it's simple,8,0,Animation,genuinely cried entire movie lmaoim considering war crime ' simple,-1
Scott Pilgrim vs. the World,2010,sree,2016-06-12,"no one: me: we have blueberry, raspberry, ginseng, sleepy time, green tea, green tea with lemon, green tea with lemon and honey, liver disaster, ginger with honey, ginger without honey, vanilla almond, white truffel, blueberry chamomile, vanilla walnut, constant comment and earl grey",4,2534,Action,"one : : blueberry , raspberry , ginseng , sleepy time , green tea , green tea lemon , green tea lemon honey , liver disaster , ginger honey , ginger without honey , vanilla almond , white truffel , blueberry chamomile , vanilla walnut , constant comment earl grey",0
Memories of Murder,2003,Matt Singer,2014-06-12,"If you love David Fincher's ZODIAC, and you wish there were more cop films like David Fincher's ZODIAC, and you haven't seen MEMORIES OF MURDER, you should see MEMORIES OF MURDER.",30,2522,Crime,"love david fincher's zodiac , wish cop film like david fincher's zodiac , seen memory murder , see memory murder .",0
The Witch,2015,iana,2018-06-12,can thy believe black phillip invented asmr thou really is THAT BITCH,6,0,Horror,thy believe black phillip invented asmr thou really bitch,0
Spree,2020,k??rsten,2021-06-12,kurt would be huge on letterboxd,6,6652,Thriller,kurt would huge letterboxd,0
The French Dispatch,2021,davidehrlich,2021-06-12,"Wes Anderson at his most visually inventive and least emotionally involving. anthologies will do that to ya. starts strong (Jacques Tati! Dirty Tilda! Benicio doing the mr. fox growl a lot), peters out as it goes. fun enough to be worthy of an editor's burial, which is really the best any of us can hope for in this barbaric slaughterhouse that was once known as humanity.",0,0,Comedy,"wes anderson visually inventive least emotionally involving . anthology ya . start strong ( jacques tati ! dirty tilda ! benicio mr . fox growl lot ) , peter go . fun enough worthy editor's burial , really best u hope barbaric slaughterhouse known humanity .",0
The French Dispatch,2021,Bernardo,2021-06-12,Wes Anderson's Tenet.,32,0,Comedy,wes anderson's tenet .,0
The French Dispatch,2021,iana,2021-06-12,a delectable tribute to journalism. packs so many intricate and eccentric details into the milieu of ennui-sur-blas?? that it's almost overwhelming (not in a bad way). it's a wes anderson film ' of course it's fantastic,9,0,Comedy,delectable tribute journalism . pack many intricate eccentric detail milieu ennui-sur-blas ? ? almost overwhelming ( bad way ) . wes anderson film ' course fantastic,0
Where the Crawdads Sing,2022,AJ Ford,2022-06-12,Lmao why was every man in this movie some kind of CrawCHAD that looked like they didn't even belong in their own time period?,16,231,Drama,lmao every man movie kind crawchad looked like even belong time period ?,1
Where the Crawdads Sing,2022,evie,2022-06-12,i know she stunk,6,2614,Drama,know stunk,-1
Brokeback Mountain,2005,ph????ng,2016-06-13,me @ me when my film teacher turned on the lights after it was over and i was the only one bawling: this is a goddamn bitch of an unsatisfactory situation,8,0,Romance,@ film teacher turned light one bawling : goddamn bitch unsatisfactory situation,0
Pulp Fiction,1994,Matt Singer,2019-06-13,"A film full of important life lessons about foot massage ethics, how to hide priceless heirlooms as a prisoner of war, what to do if someone at the party overdoses on heroin, and best practices for cleaning brain from car upholstery. Glad I saw this movie young so I learned all the stuff early.",9,2241,Crime,"film full important life lesson foot massage ethic , hide priceless heirloom prisoner war , someone party overdoses heroin , best practice cleaning brain car upholstery . glad saw movie young learned stuff early .",0
Mysterious Skin,2004,k??rsten,2020-06-13,"So violent and so innocent. I honestly can't remember if Araki had this many shots of characters looking directly into the camera in his other work but that choice is working stronger than ever here. What I really appreciate about this is how he's capturing the manipulation in all forms of abuse. His use of shoegaze also does so much as far as romanticizing not these specific events but adolescence. I just felt very close to Neil by the end, as though I was one of those little moons orbiting around him. I'll never forget about this movie.",6,3653,Drama,"violent innocent . honestly can't remember araki many shot character looking directly camera work choice working stronger ever . really appreciate he's capturing manipulation form abuse . use shoegaze also much far romanticizing specific event adolescence . felt close neil end , though one little moon orbiting around . i'll never forget movie .",0
Popstar: Never Stop Never Stopping,2016,k??rsten,2020-06-13,WHAT IF A GARBAGEMAN WAS ACTUALLY,24,2258,Comedy,garbageman actually,0
Lamb,2021,Hannah,2021-06-13,Rosemary's Baaby,6,4216,Drama,rosemary's baaby,0
Pig,2021,matt lynch,2021-06-13,A tremendous and weird story of the tangle and mystery of loss.,6,2299,Drama,tremendous weird story tangle mystery loss .,-1
Her,2013,sun,2021-06-13,Sad horny man listens to asmr girlfriend role play,20,2196,Romance,sad horny man listens asmr girlfriend role play,0
Where the Crawdads Sing,2022,KB,2022-06-13,Manic pixie marsh girl,16,3642,Drama,manic pixie marsh girl,0
Persuasion,2022,Em Lumsden,2022-06-13,I heard they've wired up Jane Austen's grave and are currently powering most of the UK from how fast she's turning in there,6,2534,Romance,heard they've wired jane austen's grave currently powering uk fast turning,0
Where the Crawdads Sing,2022,Serena,2022-06-13,What's a crawdad,16,2304,Drama,what's crawdad,0
The Devil Wears Prada,2006,Erik ????,2018-06-14,every single man in this movie is a dumb selfish disgusting whiny loser except for Nigel. big dick energy was invented for Stanley Tucci.,6,6109,Comedy,every single man movie dumb selfish disgusting whiny loser except nigel . big dick energy invented stanley tucci .,-1
Twilight,2008,sree,2018-06-14,edward: haha hey it's me your boy uhhhhhhhh icy penis bella: <3,6,3162,Romance,edward : haha hey boy uhhhhhhhh icy penis bella : <3,0
The Twilight Saga: New Moon,2009,sree,2018-06-14,charlie didn't deserve any of this,6,2316,Romance,charlie deserve,0
10 Things I Hate About You,1999,??????????,2020-06-14,me: i hate cliches,6,592,Romance,: hate cliche,-1
The Truman Show,1998,CloserLook Media,2020-06-14,This happened to my buddy Eric,16,0,Drama,happened buddy eric,0
Loki,2021,demi adejuyigbe,2021-06-14,"didn't realize Loki could just like, conjure up stuff out of nowhere. he should've conjured up a gun and used it to shoot the avengers in the head and win. I am smarter than literally every comic book character",50,6566,Action,"realize loki could like , conjure stuff nowhere . conjured gun used shoot avenger head win . smarter literally every comic book character",0
Thor,2022,tyler,2022-06-14,easily the best use of goats in film since,0,8214,Action,easily best use goat film since,1
Where the Crawdads Sing,2022,emi :),2022-06-14,"dang. she didn't have a crawdad  a crawmom :,(((",5,0,Drama,"dang . crawdad crawmom : , ( ( (",0
Before Sunset,2004,Timcop,2013-06-15,Turns out I've never had a conversation before.,8,8666,Romance,turn i've never conversation .,0
Room,2015,Lucy,2016-06-15,i cried so much that i'm now dying from dehydration,3,0,Drama,cried much i'm dying dehydration,0
Palm Springs,2020,Jay,2020-06-15,everyday i wake up,12,2664,Comedy,everyday wake,0
Fear Street: 1666,2021,aliyah,2021-06-15,maybe the real horror was the exploitation of the working class and the villainisation of marginalised peoples,6,4922,Horror,maybe real horror exploitation working class villainisation marginalised people,0
Fear Street: 1666,2021,tangerinedreams,2021-06-15,sunnyvalers about to start paying taxes,6,3313,Horror,sunnyvalers start paying tax,0
Titane,2021,Ema,2021-06-15,"Guys, I think I watched the wrong ??movie'",6,3088,Drama,"guy , think watched wrong ? ? movie '",0
Black Widow,2021,Patrick Willems,2021-06-15,"Like the makers of this movie, I, too, am a fan of Mission: Impossible - Fallout",25,2546,Action,"like maker movie , , , fan mission : impossible - fallout",0
Persuasion,2022,freya.,2022-06-15,i can't explain it but dakota johnson being in a period drama is like the human equivalent of that time they left a starbucks cup in game of thrones,39,8922,Romance,can't explain dakota johnson period drama like human equivalent time left starbucks cup game throne,0
Thor,2022,Esther Rosenfield,2022-06-15,"someone actually says aaaaand he's right behind me isn't he"" in this""""""",34,0,Action,"someone actually say aaaaand he's right behind "" "" "" """,0
Persuasion,2022,elle,2022-06-15,the fleabagfication of jane austen,6,3413,Romance,fleabagfication jane austen,0
Persuasion,2022,Ale,2022-06-15,anne elliot being made into a sassy and quirky girl is a loss for the melancholy girl community,1,0,Romance,anne elliot made sassy quirky girl loss melancholy girl community,0
Persuasion,2022,Jay,2022-06-15,me (never read persuasion) trying to get laid: wow this is nothing like persuasion,6,2245,Romance,( never read persuasion ) trying get laid : wow nothing like persuasion,0
Where the Crawdads Sing,2022,yikes !,2022-06-15,was anyone else absolutely appalled by the way he cut that cake,0,2118,Drama,anyone else absolutely appalled way cut cake,-1
Reservoir Dogs,1992,andrea????,2016-06-16,wish i could tell white men apart,6,3309,Crime,wish could tell white men apart,0
Freaky Friday,2003,Holly-Beth,2016-06-16,nothing feels more 2003 than the name Chad Michael Murray,6,2426,Comedy,nothing feel 2003 name chad michael murray,0
The Grand Budapest Hotel,2014,kayla,2018-06-16,I'm gonna write a letter to Wes Anderson asking him to be the interior designer for my home,10,0,Comedy,i'm gonna write letter wes anderson asking interior designer home,0
Her,2013,Lizzy,2019-06-16,people say you can't see scarlett johansson in this movie but parts of it were shot in shanghai and you can  see she played all the asian people in the background,6,3981,Romance,people say can't see scarlett johansson movie part shot shanghai see played asian people background,0
Fear Street: 1666,2021,emma,2021-06-16,all it took to end a 300-year curse was an angry lesbian who fought hard for her girlfriend' lesbians are powerful and men you are nothing,6,3024,Horror,took end 300 - year curse angry lesbian fought hard girlfriend ' lesbian powerful men nothing,-1
Mamma Mia! Here We Go Again,2018,Mars ????,2018-06-18,This has MAJOR continuity issues and we know the younger cast members pale in comparison to the older ones but you know what? I DON'T CARE! Lily James cartwheeling all over a field for no apparent reason watered my crops! Christine Baranski's high kick in Angel Eyes cleared my skin! Colin Firth and Stellan Skarsgard doing the Titanic pose and dancing on the ship gave me my rights! Mamma Mia: Here We Fucking Go Again Bitch!,10,0,Musical,major continuity issue know younger cast member pale comparison older one know ? care ! lily james cartwheeling field apparent reason watered crop ! christine baranski's high kick angel eye cleared skin ! colin firth stellan skarsgard titanic pose dancing ship gave right ! mamma mia : fucking go bitch !,0
Primal Fear,1996,andrea????,2018-06-18,i know u all come here on this website for some Hot Film Takes so here's one: i'd totally fuck young edward norton. imagine getting an academy award nomination on your film debut'? being the only one of the entire star-studded cast to be nominated for awards despite being 6th bill'' the stutter' that was improv. the clap at the end'? fucking improv. ignore all the other times i've told someone they exude big dick energy because this is the only time i actually mean it,12,0,Crime,know u come website hot film take here's one : i'd totally fuck young edward norton . imagine getting academy award nomination film debut ' ? one entire star-studded cast nominated award despite 6th bill ' ' stutter ' improv . clap end ' ? fucking improv . ignore time i've told someone exude big dick energy time actually mean,0
Edward Scissorhands,1990,andrea????,2019-06-18,the e in e-boy stands for edward scissorhands,0,2528,Fantasy,e e-boy stand edward scissorhands,0
The Farewell,2019,Lucy,2019-06-18,"family is so simplistically complex: grief, joy and despair are often all mixed together. this was so rhythmically calming, and i can't remember the last time i've heard an audience burst into laughter and then stop on a dime to reflect. this is skillfully made and every performance deserves recognition, but as i wrap up my review i'm gonna leave you with three words: awkwafina academy award",4,2196,Drama,"family simplistically complex : grief , joy despair often mixed together . rhythmically calming , can't remember last time i've heard audience burst laughter stop dime reflect . skillfully made every performance deserves recognition , wrap review i'm gonna leave three word : awkwafina academy award",0
Troy,2004,ashley,2020-06-18,i can excuse historical inaccuracies but i draw the line at achilles being straight,0,250,Adventure,excuse historical inaccuracy draw line achilles straight,0
The Empire Strikes Back,1980,James (Schaffrillas),2022-06-18,The only Star Wars movie to fully explore the ramifications of Yoda's ketamine addiction and that's why it's the best one,0,4495,Sci-Fi,star war movie fully explore ramification yoda's ketamine addiction that's best one,0
The Gray Man,2022,David Sims,2022-06-18,why is EVERY action sequence filled with smoke?,6,2068,Action,every action sequence filled smoke ?,0
The Lion King,2019,demi adejuyigbe,2019-06-19,this is going to sound extremely stupid but my big problem with this movie is that nobody has eyebrows and i truly believe the movie would be fine if everybody just had eyebrows,54,4316,Animation,going sound extremely stupid big problem movie nobody eyebrow truly believe movie would fine everybody eyebrow,0
The Breakfast Club,1985,Sara Clements,2019-06-19,"I get what the film was trying to do by bringing together characters of different stereotypes, but I found it so insufferable to watch honestly. And Bender treats Claire like shit the entire movie, talks about how he wants to rape her, sticks his head up her skirt, and at the end she's like, 'I luv u bb kiss kiss.' Get outta here.",13,3546,Drama,"get film trying bringing together character different stereotype , found insufferable watch honestly . bender treat claire like shit entire movie , talk want rape , stick head skirt , end like , ' luv u bb kiss kiss . ' get outta .",0
The Lion King,2019,el,2019-06-19,simba seeing scary hyenas: '?simba nearly perishing at the hands of said scary hyenas: '?simba looking at his beloved father's dead body: '?simba seeing his best friend nala after years of separation: '?,6,2695,Animation,simba seeing scary hyena : ' ? simba nearly perishing hand said scary hyena : ' ? simba looking beloved father's dead body : ' ? simba seeing best friend nala year separation : ' ?,0
Megamind,2010,Houston Coley,2019-06-19,This movie is...shockingly amazing? And clever? And well-paced? And subversive? How did I not realize this?,10,0,Animation,movie ... shockingly amazing ? clever ? well-paced ? subversive ? realize ?,1
American Psycho,2000,wobbleup,2020-06-19,he was just trying to see if they're cakes,6,216,Thriller,trying see they're cake,0
Normal People,2020,sophie,2020-06-19,the runtime is over 300 minutes but it would be about 60 minutes if marianne and connell communicated their emotions well fucking ONCE.,4,0,Drama,runtime 300 minute would 60 minute marianne connell communicated emotion well fucking .,0
The Virgin Suicides,1999,?????????Lily???????,2021-06-19,R.i.p. lisbon sisters you would have loved taylor swift,8,0,Drama,r . . p . lisbon sister would loved taylor swift,1
Old,2021,kate???s bush,2021-06-19,the real twist being that this is the beach from the solar power music video,20,2683,Mystery,real twist beach solar power music video,0
Nope,2022,Chris Evangelista,2022-06-19,I love it when movies are good.,6,228,Horror,love movie good .,1
Fire of Love,2022,Lucy,2022-06-19,when tilda swinton and john c reilly reunite for this biopic and both earn oscars for kissing near erupting volcanoes,23,0,Drama,tilda swinton john c reilly reunite biopic earn oscar kissing near erupting volcano,0
Nope,2022,Morgan,2022-06-19,wwyd if an alien took a huge dumpy on your house,10,2390,Horror,wwyd alien took huge dumpy house,0
Birdman or (The Unexpected Virtue of Ignorance),2014,sophie,2019-06-26,robert downey jr. in 10 years,16,308,Drama,robert downey jr . 10 year,0
Not Okay,2022,Tommy Spence,2022-06-26,"If you developed second-hand embarrassment and anxiety from watching this film, you may be entitled to compensation",13,2939,Drama,"developed second-hand embarrassment anxiety watching film , may entitled compensation",0
The Social Network,2010,lara,2016-06-02,imagine breaking a guy's heart so hard he invents facebook.,6,926,Drama,imagine breaking guy's heart hard invents facebook .,0
