movie_name,Release Year,Reviewer name,Clean_Review_date,Clean_Review,Clean_Comment Count,Like count,genre,Processed Review,Sentiment
The Worst Person in the World,2021,Muriel,2021-12-24,"starting to think i'm not the only person who can feel the weight of time passing resting on my shoulders every day, it's excruciating and beautiful and turns out some are just better at handling it than others. these days by nico starts playing.",0,0,Drama,"starting think i'm person feel weight time passing resting shoulder every day , excruciating beautiful turn better handling others . day nico start playing .",0
Encanto,2021,Ethan Ethan,2021-12-24,Her real powers were therapizing. No wonder why her family was distancing themselves from her.,0,2603,Animation,real power therapizing . wonder family distancing .,0
Don't Look Up,2021,matt lynch,2021-12-24,A total disaster that everyone saw coming.,1,2409,Comedy,total disaster everyone saw coming .,-1
Don't Look Up,2021,kj,2021-12-25,James corden stars in bad musicals like he's collecting the infinity stones,236,1268,Comedy,james corden star bad musical like he's collecting infinity stone,0
Don't Look Up,2021,el,2021-12-25,this happened to my buddy t-rex,6,4236,Comedy,happened buddy t-rex,0
Harry Potter and the Prisoner of Azkaban,2004,David Sims,2021-12-25,ok but like how do you WORK with dementors. like how do you tell them to show up somewhere. who do you talk to. is there a head dementor. do they speak english. can they tell time. can they read maps,20,3169,Fantasy,ok like work dementors . like tell show somewhere . talk . head dementor . speak english . tell time . read map,0
Encanto,2021,James (Schaffrillas),2021-12-25,"Changed my mind about the songs actually, they're bangers that get better the more I listen to them. This movie fucking rocks and it better not fade into relative obscurity.",6,2506,Animation,"changed mind song actually , they're banger get better listen . movie fucking rock better fade relative obscurity .",0
Encanto,2021,sree,2021-12-26,not this poor kid having to be the entire family's unpaid therapist... she better have gotten the best room,6,4336,Animation,poor kid entire family's unpaid therapist ... better gotten best room,0
When Harry Met Sally...,1989,k??rsten,2021-12-28,"she has great hair, he has god awful hair, simple as that",6,332,Romance,"great hair , god awful hair , simple",1
Encanto,2021,trin,2021-12-28,bruno living in that families mind rent free,6,2116,Animation,bruno living family mind rent free,0
The Worst Person in the World,2021,alba,2021-12-30,babe wake up a new relatable sad girl who feels lost in life just dropped,6,9412,Drama,babe wake new relatable sad girl feel lost life dropped,0
Red Rocket,2021,Megan Bitchell,2021-12-30,This is literally what people on tiktok think licorice pizza is lmao,22,2390,Drama,literally people tiktok think licorice pizza lmao,0
The Worst Person in the World,2021,Ethan Ethan,2021-12-30,"Come on, everyone knows cheating is socially acceptable if your partner fanboys over Freud",6,2346,Drama,"come , everyone know cheating socially acceptable partner fanboys freud",0
The Lost Daughter,2021,othavio,2021-12-31,at least one gyllenhaal is having a good year,9,0,Drama,least one gyllenhaal good year,0
The Lost Daughter,2021,Hungkat,2021-12-31,Was distracted most of the time because I couldn't stop thinking about Dakota Johnson's eyeliner,10,0,Drama,distracted time stop thinking dakota johnson's eyeliner,0
The Lost Daughter,2021,?????????Lily???????,2021-12-31,Wake up babe new mommy issues film just dropped,6,2302,Drama,wake babe new mommy issue film dropped,0
Harry Potter 20th Anniversary,2022,marsh boy,2022-01-01,The JK Rowling archive footage is the perfect definition of jump scares.,6,4260,Documentary,jk rowling archive footage perfect definition jump scare .,1
Harry Potter 20th Anniversary,2022,maria,2022-01-02,i am crying like a motherfucker,6,0,Documentary,cry like motherfucker,-1
Drive My Car,2021,Patrick Willems,2022-01-03,I know there's way more important stuff here but I have to point out that the 2-door red Saab is one of the best movie cars I've ever seen. Just a truly excellent car. Lots of character.,6,305,Drama,know there's way important stuff point 2 - door red saab one best movie car i've ever seen . truly excellent car . lot character .,0
Harry Potter 20th Anniversary,2022,Jay,2022-01-04,jk rowling in this is the awful grandma you no longer invite to christmas but have to facetime briefly because sadly she is the reason why everyone exists,40,8434,Documentary,jk rowling awful grandma longer invite christmas facetime briefly sadly reason everyone exists,0
The Mitchells vs. The Machines,2021,Katie Mitchell,2022-01-05,Imma go full Paul Schrader on this and rate my OWN movie five stars.,0,6254,Animation,imma go full paul schrader rate movie five star .,0
Sing 2,2021,wes10,2022-01-06,shit might actually turn me into a furry,6,2093,Animation,shit might actually turn furry,0
Scream,2022,Oli,2022-01-09,Scream movies are just scooby-doo episodes,6,6649,Horror,scream movie scooby-doo episode,0
Fargo,1996,k??rsten,2022-01-09,"having just watched , i've gained a whole lot of respect for movies that pay extra close attention to the cities they take place in. and as a minnesotan, i seriously cannot express how giddy i get watching this. i'm laughing at parts that aren't even funny! i love my unbearably cold and uncool home. a perfect movie",0,0,Crime,"watched , i've gained whole lot respect movie pay extra close attention city take place . minnesotan , seriously cannot express giddy get watching . i'm laughing part even funny ! love unbearably cold uncool home . perfect movie",0
The Worst Person in the World,2021,john,2022-01-11,That awful moment when you realize the movie is about you.,0,0,Drama,awful moment realize movie .,-1
Scream,2022,David Sims,2022-01-11,what if the real villain was horror canon,6,0,Horror,real villain horror canon,-1
Scream,2022,Lenny,2022-01-12,Tara is such an A24 bitch.,12,641,Horror,tara a24 bitch .,-1
Scream,2022,Julien Debaker,2022-01-12,Or you could just take off his mask you fucking dumbass,6,3546,Horror,could take mask fucking dumbass,0
Scream,2022,hollie amanda,2022-01-13,imagine almost dying because you only watch elevated horror,31,10362,Horror,imagine almost dying watch elevated horror,0
Scream,2022,marsh boy,2022-01-13,I just know half of those people have letterboxd accounts so no wonder that happened,6,6264,Horror,know half people letterboxd account wonder happened,0
My Policeman,2022,espooky,2022-01-13,ACAB (all cops are bottoms),11,4256,Drama,acab ( cop bottom ),0
Boiling Point,2021,Noel Mellor,2022-01-13,Fuck table  6  .,6,3406,Drama,fuck table 6 .,-1
Scream,2022,Lucy Ellman,2022-01-13,going to find myself a husband on the stab subreddit,4,2504,Horror,going find husband stab subreddit,0
Scream,2022,othavio,2022-01-13,no way home for kids who has sidney prescott as they favorite super heroine,5,2140,Horror,way home kid sidney prescott favorite super heroine,1
The House,2022,jules,2022-01-14,I wanna know more about the relationship between that mouse and his dentist,22,8566,Comedy,wanna know relationship mouse dentist,0
The House,2022,vivian,2022-01-14,baby in part one was built different,26,612,Horror,baby part one built different,0
Scream,2022,benton tarantella,2022-01-14,'ghostface is back in town. don't come here.,6,683,Horror,' ghostface back town . come .,0
Scream,2022,aaron,2022-01-14,I'M SIDNEY FUCKING PRESCOTT OF COURSE I HAVE A GUN,13,3214,Horror,i'm sidney fucking prescott course gun,0
The Virgin Suicides,1999,bonerchomper46,2022-01-14,Life is simple you are a girl and then you kill yourself,6,0,Drama,life simple girl kill,-1
Scream,2022,24framesofnick,2022-01-14,I love the part where the person screams,8,0,Horror,love part person scream,1
Spider-Man,2021,?????????Lily???????,2022-01-15,I love how everyone in this is giving a standard mcu performance while willem dafoe is acting like he's still on set for the lighthouse,20,2624,Action,love everyone giving standard mcu performance willem dafoe acting like he's still set lighthouse,0
The House,2022,atlas,2022-01-15,diversity win! that rat is gay!!!,6,2530,Horror,diversity win ! rat gay ! ! !,1
Parallel Mothers,2021,alba,2022-01-15,i NEED an architectural digest episode on janis's apartment,9,2089,Drama,need architectural digest episode janis's apartment,0
Drive My Car,2021,David Sims,2022-01-16,smokin cigs out the sunroof together,6,4006,Drama,smokin cigs sunroof together,0
The Worst Person in the World,2021,maria,2022-01-21,can't wait for the american remake with dakota johnson,6,10966,Drama,can't wait american remake dakota johnson,0
Nightmare Alley,2021,?????????Lily???????,2022-01-21,Willem dafoe looked like he was having fun and at the end of the day that's all that matters,14,694,Drama,willem dafoe looked like fun end day that's matter,1
The Worst Person in the World,2021,Megan Bitchell,2022-01-21,Oh word I'm just never gonna be happy?,2,0,Drama,oh word i'm never gonna happy ?,0
Fresh,2022,Gabriella Hughes,2022-01-21,"If sebastian stan proposed a weekend getaway after we danced around listening to blood orange and ate a take out dinner, hell' i'd end up there too.",6,4136,Drama,"sebastian stan proposed weekend getaway danced around listening blood orange ate take dinner , hell ' i'd end .",0
Fire of Love,2022,Drew Gregory,2022-01-21,"Heterosexuality is a woman being like I am risking my life to study the minutiae of volcanos"" and her husband being like """"my goal is to row a canoe down a river of lava!""""""""""",13,0,Drama,"heterosexuality woman like risking life study minutia volcano "" husband like "" "" goal row canoe river lava ! "" "" """,0
After Yang,2021,Jay,2022-01-23,the future is robots programmed to introduce children to mitski,26,194,Sci-Fi,future robot programmed introduce child mitski,0
Emily the Criminal,2022,davidehrlich,2022-01-25,a solid indie thriller about how student debt can (and probably will) turn you into the Joker.,6,3133,Comedy,solid indie thriller student debt ( probably ) turn joker .,1
Jackass Forever,2022,luke,2022-01-25,I was a PA on this movie. I've seen and smelled unspeakable things,20,0,Comedy,pa movie . i've seen smelled unspeakable thing,0
American Psycho,2000,shay,2022-01-26,just imagined patrick bateman being a letterboxd user who writes detailed reviews of movies he's watched and then breaking into a cold sweat after he sees that someone who wrote a one liner joke review got more likes than him,6,3201,Thriller,imagined patrick bateman letterboxd user writes detailed review movie he's watched breaking cold sweat see someone wrote one liner joke review got like,0
Cha Cha Real Smooth,2022,tyler,2022-01-26,academy award winner cooper raiff has a nice ring to it,0,0,Drama,academy award winner cooper raiff nice ring,1
The Fallout,2021,marsh boy,2022-01-28,I almost went saying 'the dialogue is so cringe!' then I immediately realized that is how I speak??everyday,6,6193,Drama,almost went saying ' dialogue cringe ! ' immediately realized speak ? ? everyday,0
The Worst Person in the World,2021,David Sims,2022-01-30,"You seem to be waiting for something. I don't know what.""""""""",4,0,Drama,"seem waiting something . know . "" "" """,0
Jackass Forever,2022,David Sims,2022-02-01,knoxville with silver hair'unspeakably hot,26,0,Comedy,knoxville silver hair'unspeakably hot,0
Jackass Forever,2022,Matt Singer,2022-02-01,"After 120 years of cinema, it's almost impossible to present something truly new to the moviegoing public. It's all been done ' or so it can seem until a movie like  comes along. When Johnny Knoxville proudly announces 'We have 15 gallons of pig semen!' you know you are about to see something that has never been captured by a motion picture camera before.",0,2565,Comedy,"120 year cinema , almost impossible present something truly new moviegoing public . done ' seem movie like come along . johnny knoxville proudly announces ' 15 gallon pig semen ! ' know see something never captured motion picture camera .",0
The Tinder Swindler,2022,Harry,2022-02-02,HOMELESS KING,3,233,Documentary,homeless king,0
The Tinder Swindler,2022,Kasey Carlson,2022-02-02,I wouldn't even give Chris Evans $250K,21,0,Documentary,even give chris evans $ 250k,0
The Worst Person in the World,2021,Patrick Willems,2022-02-04,That's it I'm moving to Oslo,15,0,Drama,that's i'm moving oslo,0
The Tinder Swindler,2022,Jay,2022-02-05,"when he asks for $250,000 after dating for 4 months: '''''''''?",10,0,Documentary,"asks $ 250,000 dating 4 month : ' ' ' ?",0
CODA,2021,k??rsten,2022-02-06,CODA also stands for cried on da airplane,0,6665,Drama,coda also stand cried da airplane,0
Jackass Forever,2022,LunchEnjoyer,2022-02-08,i am going to perform all of these stunts at home,6,2196,Comedy,going perform stunt home,0
Death on the Nile,2022,Bryan Espitia,2022-02-09,There's no way anything else this year tops this movie's dead-serious mustache origin story prologue.,16,4160,Mystery,there's way anything else year top movie's dead-serious mustache origin story prologue .,0
Death on the Nile,2022,MarMar,2022-02-10,"Every piece of dialogue that comes out of mouth sounds like she's trying to promote an ad for a Superbowl commercial*I'm talking about her line delivery, not her accent",25,0,Mystery,"every piece dialogue come mouth sound like trying promote ad superbowl commercial * i'm talking line delivery , accent",0
jeen-yuhs: A Kanye Trilogy,2022,Sam,2022-02-10,"our theater had technical issues so the movie started at 8:30 instead of  6  :30, so i got the true kanye experience",16,3202,Documentary,"theater technical issue movie started 8: 30 instead 6 : 30 , got true kanye experience",0
Marry Me,2022,Emma ????,2022-02-10,Every generation deserves its own Citizen Kane,5,0,Romance,every generation deserves citizen kane,0
Kimi,2022,Chris Feil,2022-02-10,Completely obsessed with the physicality Kravitz brings to drying her hands after using hand sanitizer,2,0,Drama,completely obsessed physicality kravitz brings drying hand using hand sanitizer,0
Kimi,2022,tyler,2022-02-10,the yassification of rear window (1954),6,2502,Drama,yassification rear window ( 1954 ),0
The Power of the Dog,2021,Jay,2022-02-10,why are you hating women so bad? kinda gay bro if you ask me,6,2233,Drama,hating woman bad ? kinda gay bro ask,-1
Marry Me,2022,thisshizisamood,2022-02-10,Why was it not bad and why was Jimmy Fallon a good villain,6,2163,Romance,bad jimmy fallon good villain,-1
Kimi,2022,Patrick Willems,2022-02-11,Feels like a miracle that they made a movie that acknowledges covid but doesn't need to make the story ABOUT covid and the movie still gets to be fun,6,3926,Drama,feel like miracle made movie acknowledges covid need make story covid movie still get fun,0
Licorice Pizza,2021,Jay,2022-02-13,'i can fix him' says girl who is worse,0,6690,Drama,' fix ' say girl worse,-1
Uncharted,2022,Jack Bool,2022-02-13,Mark Wahlberg is literally in a Papa John's right now.,6,4302,Action,mark wahlberg literally papa john's right .,0
Uncharted,2022,ZaraGwen,2022-02-16,Tom Holland was literally just playing Spider-Man without his powers,6,2565,Action,tom holland literally playing spider-man without power,0
Texas Chainsaw Massacre,2022,tyler,2022-02-18,this literally happened to my friend laurie 4 years ago,6,4966,Horror,literally happened friend laurie 4 year ago,0
Tangled,2010,wes10,2022-02-18,no internethorse governmentMILFSI NEED TO MOVE HERE!!!!!,0,0,Animation,internethorse governmentmilfsi need move ! ! !,0
Texas Chainsaw Massacre,2022,Theo,2022-02-18,Look how they (Texas Chainsaw) Massacred my boy,6,2068,Horror,look ( texas chainsaw ) massacred boy,0
CODA,2021,Patrick Willems,2022-02-20,I'm really jealous of how movie teenagers all seem to have??their own isolated gorge full of water to swim in,6,406,Drama,i'm really jealous movie teenager seem ? ? isolated gorge full water swim,0
American Psycho,2000,Jay,2022-02-20,lets see paul allen's NFTs,6,2485,Thriller,let see paul allen's nfts,0
Nightmare Alley,2021,k??rsten,2022-02-20,surprisingly riveting. the rise is just as thrilling as the fall and that's all i really needed out of this to feel satisfied. should've never doubted gdt,0,0,Drama,surprisingly riveting . rise thrilling fall that's really needed feel satisfied . never doubted gdt,1
The Batman,2022,David Sims,2022-02-24,bringing Batman back to his roots as a guy who mostly walks around and has growly chats with this one gruff cop,14,6690,Action,bringing batman back root guy mostly walk around growly chat one gruff cop,0
The Batman,2022,the film drunk,2022-02-24,Sex for the eyes,18,494,Action,sex eye,0
The Banshees of Inisherin,2022,Lia Allison,2022-02-25,That one unemployed friend at 2pm on a tuesday:,23,1650,Comedy,one unemployed friend 2pm tuesday :,0
Everything Everywhere All at Once,2022,ian,2022-02-28,rocks just made me cry,38,19365,Sci-Fi,rock made cry,-1
The Batman,2022,La Revolver Perez,2022-02-28,No habla espa??ol?!,21,6606,Action,habla espa ? ? ol ? !,0
The Batman,2022,ConnorEatsPants,2022-02-28,i said this movie had some pacing issues then a guy with a batman pfp left 6 comments explaining how I 'didn't get it' when he hadn't even seen the movie yet,6,2625,Action,said movie pacing issue guy batman pfp left 6 comment explaining ' get ' even seen movie yet,0
The Batman,2022,tyler,2022-03-01,in 100 years the one thing that all film critics are going to agree on is that the batman (2022) truly was,6,310,Action,100 year one thing film critic going agree batman ( 2022 ) truly,0
Turning Red,2022,Rendy Jones,2022-03-01,Pixar's LADY BIRD for 13 year old girls which is practically saying it's a perfect movie that marks as one of the best Pixar movies of all time.,18,4326,Animation,pixar's lady bird 13 year old girl practically saying perfect movie mark one best pixar movie time .,0
The Batman,2022,BananaPudding,2022-03-01,Black Panther for people who listen to Disintegration by The Cure and Unknown Pleasure by Joy Division for fun. Annoying mfs are gonna have a field day with this one,66,0,Action,black panther people listen disintegration cure unknown pleasure joy division fun . annoying mf gonna field day one,0
The Batman,2022,othavio,2022-03-01,i am just like batman completely obsessed and mesmerize with zoe kravitz,1,2164,Action,like batman completely obsessed mesmerize zoe kravitz,0
The Batman,2022,???? Zara ????,2022-03-02,god paul dano's riddler was such a delightful little freak with his instagram lives obsessed with him the girlies are gonna have a field day poor little meow meowing him,43,10624,Action,god paul dano's riddler delightful little freak instagram life obsessed girlies gonna field day poor little meow meowing,0
The Batman,2022,ash,2022-03-02,Marvel Studios you are officially fucking dead to me,6,460,Action,marvel studio officially fucking dead,-1
The Batman,2022,24framesofnick,2022-03-02,"After sleeping on this, I can confirm this movie fucking bangs. It's one of those movies where the more you think about it, the better it is",41,210,Action,"sleeping , confirm movie fucking bang . one movie think , better",0
The Batman,2022,hollie amanda,2022-03-02,shoutout to emo batman gotta be one of my favourite genders,5,0,Action,shoutout emo batman gotta one favourite gender,0
The Batman,2022,Jonathan Oppenheimer,2022-03-03,We need to stop pretending that Batman isn't at least a little silly. If a man dressed like that came up to me and I asked him who he was and he said 'I am vengeance' I'd probably laugh at that. It's a silly thing to say.,6,8564,Action,need stop pretending batman least little silly . man dressed like came asked said ' vengeance ' i'd probably laugh . silly thing say .,0
The Batman,2022,AmandaTheJedi,2022-03-03,That score's gonna be stuck in my head for days holy shit.,0,368,Action,score's gonna stuck head day holy shit .,-1
The Batman,2022,Lucy,2022-03-03,left the theater so bummed out that i had to cry along to a cranberries cd on the drive home. so suffice it to say: the emo batman i've always dreamed of,16,306,Action,left theater bummed cry along cranberry cd drive home . suffice say : emo batman i've always dreamed,0
The Batman,2022,sophie,2022-03-04,"her name may be catwoman, but i was",6,10330,Action,"name may catwoman ,",0
Fresh,2022,belle????,2022-03-04,fuck it. let's get more movies with 30 minute intros,6,9939,Drama,fuck . let's get movie 30 minute intro,0
Fresh,2022,tawni????????,2022-03-04,this would never happen to me because i have social anxiety,5,8905,Drama,would never happen social anxiety,0
The Batman,2022,sree,2022-03-04,"this one's for the emos, goths and whores",6,6066,Action,"one's emos , goth whore",-1
Fresh,2022,Leah,2022-03-04,his name is steve girl what did you expect,6,249,Drama,name steve girl expect,0
Turning Red,2022,the film drunk,2022-03-04,Something about Asian food in animated films hit different,6,0,Animation,something asian food animated film hit different,0
Fresh,2022,bre,2022-03-04,daisy edgar-jones world domination is upon us,6,2408,Drama,daisy edgar-jones world domination upon u,0
Fresh,2022,lisa ????,2022-03-04,*fear of dating intensifies*,0,2162,Drama,* fear dating intensifies *,-1
Fresh,2022,trin,2022-03-05,This review may contain spoilers.,15,12105,Drama,review may contain spoiler .,0
Fresh,2022,alor,2022-03-05,I could fix him,26,8566,Drama,could fix,0
The Batman,2022,?????????Lily???????,2022-03-06,Committing a crime in gotham city so i can see robert pattinson batman and ask him what his favourite mitski album is,34,695,Action,committing crime gotham city see robert pattinson batman ask favourite mitski album,0
The Batman,2022,sophie,2022-03-06,"i just love the idea that when he sees the bat signal, bruce wayne has to take a few minutes to apply his eyeliner first",6,342,Action,"love idea see bat signal , bruce wayne take minute apply eyeliner first",0
After Yang,2021,?????? Liam ??????,2022-03-06,probably the best opening credits scene ever,6,3510,Sci-Fi,probably best opening credit scene ever,1
Turning Red,2022,Ella Kemp,2022-03-08,'I like gyrating' gotta be quote of the year,6,3405,Animation,' like gyrating ' gotta quote year,0
After Yang,2021,k??rsten,2022-03-08,second time this week where i wanted to look like colin farrell in a movie,2,2643,Sci-Fi,second time week wanted look like colin farrell movie,0
Fresh,2022,andrea????,2022-03-09,white woman's,6,936,Drama,white woman's,0
Turning Red,2022,Barracuda,2022-03-09,I suppose you could classify this as a 'period piece',23,692,Animation,suppose could classify ' period piece ',0
Everything Everywhere All at Once,2022,k??rsten,2022-03-11,cutest husband in the world,0,16545,Sci-Fi,cutest husband world,1
Turning Red,2022,???? Zara ????,2022-03-11,really appreciate how it captures the essence of being 13 and your mum discovering your cringey anime inspired fanart,30,10082,Animation,really appreciate capture essence 13 mum discovering cringey anime inspired fanart,0
Turning Red,2022,24framesofnick,2022-03-11,PERIODS? IN MY DISNEY MOVIE'?? THIS IS OUTRAGEOUS!!!,6,6190,Animation,period ? disney movie ' ? ? outrageous ! ! !,-1
Turning Red,2022,cleo?????????????,2022-03-11,ok but why are they called 4 town if there's 5 of them,30,336,Animation,ok called 4 town there's 5,0
Turning Red,2022,wes10,2022-03-11,I WANT TO TOUCH THE FUR. I KNOW EXACTLY WHAT IT WOULD FEEL LIKE IT JUST MAKES TOO MUCH SENSE. I WANT TO TOUCH THE FUR,0,233,Animation,want touch fur . know exactly would feel like make much sense . want touch fur,0
The Adam Project,2022,RyLan,2022-03-11,This is the  6  th Ryan Reynolds film in a row where he just plays Deadpool in a new situation.,6,16,Sci-Fi,6 th ryan reynolds film row play deadpool new situation .,0
Turning Red,2022,?????????Lily???????,2022-03-11,disney: cool film you've got there,6,4189,Animation,disney : cool film got,0
Turning Red,2022,neelam,2022-03-11,another day another movie for the mommy issues girls,6,2688,Animation,another day another movie mommy issue girl,0
Turning Red,2022,?????? Liam ??????,2022-03-11,meilin lee in her lady bird era fr and i am very much here for it this was so refreshing and such a blast thank you pixar once again!!!,6,2436,Animation,meilin lee lady bird era fr much refreshing blast thank pixar ! ! !,0
The Adam Project,2022,oleff,2022-03-11,man if i was like 10 i would fucking love this movie,8,0,Sci-Fi,man like 10 would fucking love movie,1
Marcel the Shell with Shoes On,2021,zoejudilla,2022-03-12,'guess why i smile a lot.',8,3935,Animation,' guess smile lot . ',1
Jujutsu Kaisen 0,2021,geraldho,2022-03-12,chad womaniser yuta vs based virgin geto,6,2259,Animation,chad womaniser yuta v based virgin geto,0
The Adam Project,2022,tyler,2022-03-13,shawn levy really should have called this??instead,0,4311,Sci-Fi,shawn levy really called ? ? instead,0
Turning Red,2022,Aki Menzies,2022-03-14,"'You remember being 12, when you're like, 'No one look at me or I'll kill myself.'' - John Mulaney",11,0,Animation,"' remember 12 , like , ' one look i'll kill . ' ' - john mulaney",0
Turning Red,2022,CinemaJoe,2022-03-14,ThiS mOVie IS sO uNrELaTABle,6,2418,Animation,movie unrelatable,0
X,2022,demi adejuyigbe,2022-03-15,I swear I started levitating during the movie,52,1153,Horror,swear started levitating movie,0
Turning Red,2022,dumbsville,2022-03-15,"I couldn't relate to this movie since the characters aren't addicted to heroin, but it was fine ig.",6,2402,Animation,"relate movie since character addicted heroin , fine ig .",0
Jujutsu Kaisen 0,2021,isa,2022-03-16,none of this would've happened if gojo and geto had just kissed,2,0,Animation,none would've happened gojo geto kissed,0
X,2022,AmandaTheJedi,2022-03-18,"Tag yourself, I'm 'cries in shower'",0,0,Sci-Fi,"tag , i'm ' cry shower '",-1
Morbius,2022,saskia <3,2022-03-20,paul allens batman,36,9494,Action,paul allen batman,0
